ID,first_three_sentences
rACQs1LjqrU,"hey, did you know you could eat this whole spaghetti squash for less calories than that measly PL a pasta? yeah, and look how big it is. you'll be full for sure."
WrKhtmkc7yI,"this literally changed my life. I hate cutting cauliflower cuz it's so messy, but apparently when you just smack it on the counter, it all falls apart. I didn't even have to get out a knife and all the mess is contained."
Lg10vWva6Iw,"[Music] in the in the house. in the house, I got a cute face."
xfhw7P2JUAw,"you kids are baking me, so scared with your costumes. here's some butter packets. look at you."
4zBM81L3k4s,"ooh, what you making. I'm making healthy apple donut pancakes. you just take apple slices, plop them into the pancake batter- I'm using the protein kind- make sure they're nice and coated, then put them in a pan easy."
eGl3HQg-Xqk,the switch witch has arrived. a what you don't. do that with your kids?
lkfUQqS_9bA,"out of all three ways. the Third Way is probably my favorite, but I'll let you decide. option number one is to melt some peanut butter with honey and then you're going to add some crushed up corn flakes, allow these to harden in the freezer as you melt chocolate and coconut oil, and then you're going to cover them."
89bRE6563D4,"did you know that if you take cottage cheese, add some marinara sauce, Italian seasoning, top it with your favorite pizza toppings, add some cheese, then pop that bad boy in the microwave for 1 to 2 minutes and you will be left with a high protein Pizza Bowl. it is actually delicious, but there's one tweak we got to make to it. there's really no source of carb, so grab yourself some P chips to have with it."
rRZjG67xc04,"sweetie, you stop guzzling all of that apple cider. there is like so much sugar in there and you should never drink your calories. such a waste."
cuIEuGTw2yw,"what you doing. oh, I was going to bake some brownies. want to join?"
Rttsyy30B7k,"this recipe is about to break the internet. did you know that if you take an apple, cut it into slices and take the core out and top it with peanut butter, melted chocolate and- if you want to get really crazy, some sprinkles, you are going to be left with such a super cute snack that looks like a donut. it is absolutely delicious, but it is not a replacement for a doughnut because it does not resemble it in any other way, shape or form."
LG-1Hwg1nc8,"1, 2, 3, 4. Everybody Makes Mistakes, everybody has those dayses. everybody knows what one talk about, everybody."
HtCw1ul1WgY,"I am about to blow your mind. I don't know if you guys know this, but if you take a banana, slice it in half, slather some peanut butter on top, then some crushed peanuts, tap it off with some melted chocolate. Pop these babies in the freezer."
XRGMqDY1OZg,"hey, did you see that Tina lost some weight? good for her for taking care of her health. her body may have changed, but that doesn't necessarily mean she's healthier."
mM9NwSWqTng,micro has so much processed food. hers is basically all veggies. she must be so healthy.
SVeJQy0Pq0I,what are you doing? don't use that. use these instead.
eh4WJ8ey4qo,"here's everything I ate in Boston for three days with no food rolls. favorite thing that we ate- it's a tie between Lobster waffle and the cannoli. so even though I'm a registered dietitian, I have not touched a single vegetable today, and that's okay."
8AvQp461Lqo,time for breakfast. what you making. I'm embracing a life of no food rolles.
zRU81OKuhlE,never throw away an empty peanut butter jar. [Music].
WziE8fmd9BI,smoothies should only have a half a banana. a full one is way too much carbs and sugar. I'm only gonna add half a bananas today for my personal preference if I also add the blueberries I want to add.
S_vuWUEITHY,"don't eat this processed junk. we should all be eating whole, unprocessed foods, but I live in a food desert and I don't always have fresh options. but this is all I can afford right now."
WK1lXbvmgYM,"emotional eating is not bad. I felt so much joy and gratitude while on vacation with my husband as we ate delicious food and created new memories. I don't know about you, but I don't want to live a life where food isn't also a form of bonding joy and happiness."
at3KXBk1zac,"hi everyone. oh, Tina, I see you brought some donuts there. having a little cheat day, are we?"
wVdnCDbSzRY,"oh man, well, good Morning, Starshine morning. where's the coffee? it's over there and there's some creamer in the fridge."
ghGKyrIQG5M,"oh girl, put that thing down. I've got a healthy cookie hack you're going to love. oh boy, what is it?"
c4nk7EQ3amw,"we're going to do a little healthy Trader Joe's snack review. is this Greek style elote dip a healthy option? okay, next we have these plantain chips."
AecvEcFosno,"oh, your mom gave you a Lunchable. oh, you're so lucky, whoa, your mom gave you packaged food. is she trying to kill you?"
bXPuMLc2KEw,"I'm a registered dietitian and I'm going to show you how to order a guilt-free pumpkin spice latte. can I have a tall pumpkin spice latte please? that'll be all, thank you."
_a71Pv2q7kk,granola. are you gonna get the Special K? it's like way lower in calories.
bMlRCk4XHBE,"breakfast time. huh, wait, are those waffles? yeah, I had a hankering, so I bought a box of Frozen ones."
eqxm-xi3Wy0,"these Frozen s'mores are currently stocked in my freezer and they could not be easier to make. take a chocolate pudding cup. add it to a bowl, fold in some whipped cream."
JzVkmmi4j1U,"um, those are not muffins, those are cakes. way too many carbs for the morning. oh, I love these."
UaJO21-0l0U,I am back with another full day of eating. I went to the gym this morning. I usually eat granola.
WDf28vHr5jg,"oh man, Heather took so much less food. she's not a little piggy like me. her self-control is probably how she dropped the baby weight so fast."
Z1kB_RloPdo,half foot around that you could air fry oatmeal cream pies and then top them with ice cream and it's like next level. I've got to try this. [Music].
SKwrXQ92cbg,"hello class. I am Professor Health, babe, and today's lesson will be on vocabulary. please turn to page 287 in your textbooks and we will begin now."
UyZk8HKw82E,"come on, um, I cannot stop eating these because they are so good. yeah, duh, what else would it be? well, maybe you keep eating it because it is so delicious, and when it's gone you're gonna feel sad that it's gone."
TUNHBgqcGY4,"guys, where are your green juices? don't you want to detoxify? what's up, Potter?"
uPWFmgZ5OqU,"I am obsessed with these Berry cheesecake overnight oats. I won't lie, I was skeptical with how they were gonna taste, but they are so good, so filling and so freaking easy to make. all you have to do is combine milk, Blended cottage cheese, oats and vanilla, pop some berries in there, then let it sit at least two hours or overnight."
cAXsLFYLX0o,"oh girl, hang on, I've got a healthy eating hack you're gonna love. it doesn't involve black beans, does it? no, here you take a chocolate protein bar, microwave it, and it tastes just like brownie, but like way better for you."
4V3IqJnbMhY,"oh, hey, girl, what's for dinner? I made some pasta. there's some in the pot."
fCV6Z5L0vMw,"hey, girl, I hope it's okay. I brought some snacks. I wasn't sure what you were gonna have and I don't know if I told you this, but I started a new diet."
phqxPm-Dj5E,"oh my gosh, look at her. she's like a freaking gazelle. I'm so lazy, I'm just walking."
zvgBqcL8WZ4,"oh, my thighs are huge. these shorts are too small. I need to go on a diet."
Our6q9WQgTo,"what are you doing? eating a donut, yeah, but you just worked out, so you're like negating the last hour. what was the point?"
aUUGKv8aUss,state park has gone viral. you have to try this viral date bar. it tastes just like a candy bar.
j0FEuAhlBi4,thank you. [Music]. perfect one cup for breakfast.
lAt9lUJidoE,"I don't know about you, but I'm the type of girly who firmly believes chicken salad tastes way better with fruit in it. blueberries are in peak season and we picked 15 pounds of them. the other weekend I took my super easy basic chicken salad that I make all the time and added blueberries and almonds."
MHx4dSrs_hY,"look, it's iced cream. cauliflower can be anything if you try hard enough. don't eat the cone."
7SbfsQfgYEo,"[Music]. oh sweetie, don't eat too much of that. your dad got the sugary stuff again."
71eC8SnNXSc,[Music].
ZBPxV7x_QlQ,"oh, sweetie, don't be rude here. have a slice of the cake your Aunt Tina make. oh no cake for me."
kgxPoBCqalA,man. her butt looks so much better in leggings. mine looks all lumpy and jiggly.
BSxtE2kY8V8,it's okay if you're hungry and need a snack when no one else is. it's okay if the snack you had yesterday doesn't fill you up today. it's okay if you need multiple snacks between meals.
cJbtNb8iVcs,"[Music]: two teams, two trainers. I like to push people go, go, go very hard."
-BBMgKwHXMM,"again. oh, I'm gonna get the cookies. Hells yeah, Zebra Cakes, chocolate ice cream."
tB-_v_DOumI,"I feel like I do so good during the day and it all goes out the window at night. [Music], restricting food and then binging. throughout my own struggles, going two steps forward, one step back, I have found a method that works."
AXSs5hS819Q,that's my ideal meal. this is my dinner. I call this girl dinner [Music].
0SW28rPDyVI,"here are three ways to strengthen your hunger and fullness cues. you're actually not going to follow them at first, feed your body every three to six hours max. aim to include carbs to and protein at most meals and don't focus on eating your food."
eyFj8Qn-dfQ,"oh, you should really be eating smaller, more frequent meals to boost your metabolism. no, no, no, no, no. snacking is so bad for you."
KIl4vSdy4NA,"here are three ways to strengthen your hunger and fullness cues. you're actually not going to follow them at first, feed your body every three to six hours max. aim to include carbs, fat and protein at most meals and don't focus on eating your food."
qtS1DBEQHIQ,"this recipe makes four servings. funny, that'll serve too."
j5r--PpmyAE,"all righty. oh, are we doing some bacon? nope, making a sandwich with the food scale, measuring cup and calculator."
Tal7sdZ0ScY,stop trying to listen to your body. I'm not kidding. the number one mistake I see people make when they try to stop dieting is trying to follow their hunger and fullness cues too early research shows that dieting makes your hunger cues unreliable.
xZc-R0s09mI,"case nobody told you today, in case nobody made you."
P7AFVJy4joU,I understand nothing.
iPVKxiYLhNY,you really make this taste like this kind of obsessed with cottage cheese edible cookie dough. first thing we're supposed to do is blend our cottage cheese with maple syrup. I'm gonna still tastes kind of cheesy.
h7Hba6-yruI,this is the worst.
5nF3yO4ZnEo,"hey, we're gonna go on the ice cream run. do you want to come with? oh, hang on, let me check."
b5pQgXacFfM,"hello, I brought my favorite appetizer. I call it red, white and butter. don't worry, I've got us covered with a serving utensils."
KaLFfBPP8SA,"alrighty, I'm gonna have the hot dog and a burger. oh hell, yeah, potato salad. step aside veggie tray chips, cookies and a cupcake."
XelBsKn7obw,honey. don't touch that chemical filled junk. sugar is so bad for you and you're basically an addict here.
vEUzMFvesTk,"oh, I can basically feel everyone's judgy eyes on my plate. man, that chick eats a lot. what a little piggy she's having a bun and potato salad."
02Nkwg3VlUs,"this doesn't have very many calories. I'll add something to it so my body gets the energy it needs and I'm not hungry 20 minutes later. oh, this doesn't have very many calories."
WMXcTIFq3RQ,"no, sweetie, don't eat all of Mommy's 100 calorie packs. okay, sweetie, don't touch anything that comes in a package. yeah, it's all chemicals and you'll die."
8hSIvcfy6FI,"make any salad way tastier and way more filling with these cornbread croutons. always remember to add a source of carbs to your salads, and this one adds a touch of sweetness which is just perfect. all you have to do is get a box of cornbread mix and prepare it to the package directions."
EcR6WKu5LG0,"none of my undies fit. girl, you gotta fix that. two small undies are like the biggest trigger for bad body image days."
fkSQZ08eNDA,"sweetie, it's so good to see you. I made one of my famous, award-winning cherry pies here. have a slice."
gQXKU90Ewjs,micro has so much processed food. hers is basically all veggies. she must be so healthy.
v4lRTCVezhA,"I would get like 10 pounds from eating a single cookie. I used to feel that way too, but the reality is your body doesn't really change after eating a single cookie, even though we physically feel like it does. it's kind of a messed up mind trick that diet culture plays on us called embodiment."
n96W4MLdxuo,"[Music] foreign. oh my gosh, you're being so healthy. you have so much more self-control than I do."
AWCZvQ0aRKw,"you are such a little piggy. where is your willpower? you're hungry again, didn't you just eat?"
k1TW6MbUyxc,you have got to try this life-changing ice cream. it's made with cottage cheese. I made pancakes healthy by using cottage cheese.
0rHqeEmi7IM,"lunch time, same here. I'm starving. what you got there?"
uAqjN-URYS8,"didn't you have toast for breakfast? yeah, one sliced peanut butter banana and one slice with a fried egg, and now you're eating a sandwich. that is correct, very observant of you, isn't that kind of like a lot of bread?"
rWpoxYTWjKE,"hey fit fam. today I'm going to show you everything I eat in a day, but first let me give you a good look-see at how ripped I am. friendly reminder that when a full day of eating leads with a body check, the underlying message is likely: if you eat what I'm about to show you, you will look like this, which is 180, not true?"
Cie_8QyHxHE,"we never restrict how much food you're allowed to eat, as long as you pick from this list of food that has none of the calories that your body's actually looking for. we don't label Foods as good or bad, but these Foods get the green light, and green means go, so have Adam. and these foods have a red one, and we all know what a red stop light means."
YapNdkKMvoc,"oh hey, hot stuff. I just love the way that your tummy's got some of that jiggly jiggly and that cellulite on your thighs. it's so in right now."
gLgtR0MQpII,what I ate yesterday does not dictate what I eat today. I will fuel my body normally and not cut back. I don't need to make up for what I ate by burning it off.
DlgUyrTJrXI,"saying I'm obsessed with these is an understatement. let me show you how to make these cookies and cream pudding pops. take one vanilla pudding cup, add it to a bowl and mix it with a half cup of whipped cream."
Wnq0MdBqGco,where my girls? [Music].
npgrefXxxYc,I'm eating ice cream for breakfast because no food rolls. I got fast food because no food rolls. I'm having a third cookie because no food rolls.
LrcuiAKQlQ4,two life-changing bacon hacks you need. let me show you how. I just started cooking my bacon in the oven and I'm wondering why I've not been doing this all along.
QnVZ_mStF_I,"all right, sweetie, we won't be eating for a while, so how about we have a snack now so we don't get too hungry? oh, look at all of this delicious food. now."
73VNivdIpfQ,"oh man, Heather took so much less food. she's not a little piggy like me. her self-control is probably how she dropped the baby weight so fast."
l1n4zGy8ttA,"foreign. have you lost some weight? nope, you're right, you haven't."
fjjRAGK0wJ0,"it's okay if you prefer to eat whole unprocessed food. okay if you, if you prefer to buy organic. it's okay if you prefer to eat a Snickers date instead of a real one."
U-UYkl_V6Bk,"oh my gosh, stop. don't even know what cheese is addictive. oh, is it."
xypVakDwq5I,"okay, bread eggs, oh eggs, like whole eggs. they're a super easy way to add a high quality protein to basically anything. if you're looking to add some protein, just get a carton of egg whites only or, better yet, a protein powder."
A7CMYB7H7XA,"it feels so gross I ate like crap this weekend. Oh, don't beat yourself up. it happens I've got to cut back this week: no carbs, and I don't even want to see a dessert."
6GblDaIANGA,"[Music], sometimes [Music]."
6R8ULeFu4Nw,"all right. does anyone want any more food? before I put it away, how are tummies feeling?"
hEruAgRUCLk,time for breakfast. what y'all making? I'm embracing the life of no food rolls.
2PT78iXtods,Rachel looks so thin in that dress. I wish I looked like that. I hate my curves.
1mua5xmBZv4,foreign. I brought my famous crustless egg white quiche- zero points. I haven't eaten all day.
ZlAO6NSq-xg,"gotta blame it on my juice, baby. [Music]."
FTuTetgyTfg,"here you go, sweetie. how can you feed your child that toxic junk food isn't toxic? I'm teaching her how to have a healthy relationship with all food, even the ones that I call more Soul nourishing but you call junk food, so that way she doesn't grow up to feel out of control around them like I did."
ZeLcbyBrLcE,"hey, fit fam. today I'm going to show you how much sugar is in one of these pints of ice cream. buckle up, wow, how unhealthy."
yUQRl-uXjH4,"just because you ordered dressing on the side doesn't mean you're being diety. just because you choose carrots over pita chips for your hummus, it doesn't mean you're being deity. just because you choose a diet pop doesn't mean you're being diety."
xwKdlyI-DbQ,"oh, sweetie, don't eat this. it's full of toxic chemicals. have this 23 bowl of high protein keto cereal."
ijVxuEU-bPE,"you're drinking orange juice. what is this 1991.. you should really be drinking kale, spinach, celery juice instead. excuse me, orange juice is basically just like drinking a bag of sugar."
xNk23WwfBnU,"monkey, you got chocolate milk. all they had when I got there was white milk. that's crazy, my gushers."
JtCjUWz2mW8,"hey, did you know you can eat this whole spaghetti squash for less calories than that measly plate of pasta? yeah, and look how big it is. you'll be full for sure."
mcKuZiD5rQM,"okay, why'd you have to bring that up?"
bMALsMpG6I8,fruit has too much sugar. should you really be eating that? but you should totally start this.
0sZxcykqoic,"didn't you have toast for breakfast? yeah, one sliced peanut butter banana and one slice with a fried egg, and now you're eating a sandwich. that is correct, very observant of you, isn't that kind of like a lot of bread?"
Kyu2HW4GQkY,do you need to lose weight or do you need to learn how to not bingy? do you need to lose weight or do you need to focus on choosing foods that make your body feel good? do you need to lose weight or do you need to focus on finding forms of movement that you actually enjoy?
GDKDdd2vEGU,hate my body. maybe I'll try those Slim Fast shakes that'll fix it. I would kill to look like that again.
rp4SB8CNZRw,"oh, I think I broke another hip. I'm planning another trip, Carol, I won't be going. I can't get out of this hunch."
2-_wFWqzIu4,"again. oh, I'm gonna get the cookies. Hells yeah, Zebra Cakes, chocolate ice cream."
gvUwQ7o7Tec,"she must be so healthy. look how thin she is. oof, they must be on the brink of diabetes with a body that large."
KUrBFb_zz-g,the non-night space had just gone too far. some people do need to lose weight for their health. I get why you feel that way.
XIm2Pa-DOyc,"oh, your mom gave you a Lunchable. oh, you're so lucky, whoa, your mom gave you packaged food. is she trying to kill you?"
cNQr80-FylY,you don't need to fear of processed foods. enjoy them. Are you seriously telling people not to eat Whole Foods?
MQ9YWKtBoGM,"hey, healthy Hustlers. today I'm going to show you my grocery haul and give you some of my best tips for healthy eating. so I went to my local Whole Foods- it's the only place I ever shop- and I got these organic, non-GMO, locally grown, pesticide free apples."
oHXx5m5sEQk,"oh man, I'm eating so much more than Rachel. she's just having a salad. she's so healthy."
63uB5agcWVQ,"Agnes, won't you be a deer and pass me the oatmeal? thank you, sweetie. I don't know what I at 632 today for breakfast I, I sweet cheeks granny with you, but I had a chocolate pudding with lunch."
1RnFg9wWlKg,"oh, I literally can't eat anything anymore. what why? I did one of those at home food sensitivity tests and everything came back as positive for a Sensitivity."
zKBUWDVluQs,foreign [Music].
SdU9s1vPtGo,"I really shouldn't be eating these. they're so bad for you. oh, you don't need to feel bad for eating a cookie."
y71K94hH_pU,"I just don't get how people don't start their days with a big old glass of lemon water. so great. it gives me so much vitamin C, keeps my body's pH levels in check, it really has an alkalining effect on the body and it detoxes my system from that toxic sludge that builds up from our food system of all chemicals."
Btw7ongBzo8,"love pasta. it's my favorite thing to eat. anyway, you serve it to me, I will thank."
DrlpdTZ7yN8,"so the issue with social media is that it kind of shows you a false idea of what intuitive eating actually is. it means a lot of people to just be in the not dieting phase, as I call it, and they're not actually eating intuitively. if you are eating with no food rolls and you're like this just doesn't feel very good to me, that might be a sign that you're not actually eating intuitively, or just not dieting, which is a great step."
IWTav04aA8Y,"oh, [Applause]. push pop, I'm taking this home with me, is that okay amazing."
JXVrm_2OYXM,[Music]: foreign [Music].
OQl5LDy3qdQ,"do you know how long it takes to burn off a single m m? I do. when I was in sixth grade, my PE teacher gave us a single m?"
C1O-F3Ucc0M,"have you tried the trending peanut butter bowl? I see your peanut butter bowl and I raise you a peanut butter protein bowl. I do really dig the peanut butter here, because peanut butter can help you feel full."
P81QfJ6XwGA,"I should not be eating two slices of bread. this is way too many carbs. remember, your body needs carbs."
2u61yJJD3AM,"hi, hi, hi. would you like some Girl Scout cookies? yes, I would, but I really shouldn't."
VVYMtuv2AIc,"let's see here. excuse me, young man, do you have any egg beaters? way less calories."
mc6wKIb2Kws,"okay, why'd you have to bring that up?"
g9JACILmKc4,"here are some no food rule snack ideas when you're strolling at target bars are always super efficient and convenient. if you like the brand name ones, check out Target's good and gather brand. for a fraction of the price they got a huge selection of nuts which are Super filling and such fun flavors."
qrSxlUNuYeA,"I eat so healthy. my friends call me the healthy one of the group. oh, is that so?"
PnCstYnCzSk,"hey, did you see? Tina gained some weight. she's really letting herself go."
n9RZXj950YM,cauliflower really can be anything. you shouldn't have you make everything so much butter dates. you do love me.
-drUIJ7EqNw,"hmm, this is unreal. let's make a white chocolate raspberry pie. first thing we're going to do is melt some white chocolate chips."
Hk8NjstFNBc,"hello, sweetie. it's so good to see you. I brought you a chocolate cake here."
jhrIkvJ4_54,"it feels so gross I ate like crap this weekend. Oh, don't beat yourself up. it happens I've got to cut back this week: no carbs, and I don't even want to see a dessert."
JhnfawQ07ow,three ingredient guilt-free chocolate pie. I'm gonna be completely honest with you. I've never made this before.
Q9VDAB-rPz0,"hey, did you know you can eat this whole spaghetti squash for less calories than that measly plate of pasta? yeah, and look how big it is. you'll be full for sure."
27A0r1sHT30,"foreign hello. eggs aren't even good for you, like, have you heard of cholesterol? sure have."
txdL8oKbTw0,"here- you might as well just be eating this straight from the bag- that whole pretzels are basically sugar thing. is so not true? they're a fabulous source of carbohydrate, AKA energy, that our body needs."
22-9AlCIhSI,it's about damn time turn up the music. [Music].
SpzCT0lba6M,"think I need another snack. but that usually fills you up, yeah. well, not today."
QOfyOZTTlsI,"didn't you have toast for breakfast? yeah, one sliced peanut butter banana and one slice with a fried egg, and now you're eating a sandwich. that is correct, very observant of you, isn't that kind of like a lot of bread?"
mcv6bwtcstM,"shut up. it is not, yes, it is no, it's not yes, it is."
KtyrQgKQELk,"hey, babe, I'm gonna have some ice cream. do you want any? no, okay, if he didn't need any of it, do you really need it?"
Bc7iQsg7vgQ,"think I need another snack. but that usually fills you up, yeah. well, not today."
c7gqT7YXbGE,"I've never told anyone this before, but I'm addicted to peanut butter."
Nc4polAqCkw,"have you heard of Cato, the first one that allows me to have butter? you know I love my butter. well, maybe these cute little containers- they're all colorful and stuff- but where are the adult sizes?"
sjCGKYBXWjA,"if you can't control yourself around the food, keep it out of the house. if you're not hungry enough to eat an apple, you're not really hungry. never eat ingredients you can't pronounce."
_OJc6ot5t4A,"I'm only going to eat Whole Foods from now on. piece of cake, cake of which I won't be eating. this is, uh, kind of harder than I thought."
iUw68tci-W8,"let me tell you why dieting doesn't work. so I want you to pretend that you have to breathe through a straw. you're getting some of the air that you need, but not enough, and after a while you're gonna feel it you need more air."
p1ZH0ZYfqEw,"Carol is so lucky she doesn't take after our side of the family. she is all limbs. sorry, you got the short end of the stick, sweetie, we better put these down."
bwhBHcbeqRg,foreign [Music].
yPL2sb1Rqa0,I think they forgot to make the cookies. Take a Hint from the reindeer. what's that supposed to mean?
