ID,first_three_sentences
do8O1YxzdVg,"if you don't like eating veggies, this video is for you. as a dietitian, one of the most common things I hear is that people don't like vegetables and, honestly, I totally get it, which is why I always recommend preparing them in different ways. for example, make a chopped salad box and use this as a dip for your chips."
bpsKYwQffes,"if you are not freezing your rice, this is your sign to start. I'm a dietician and welcome back to realistic nutrition tips. if you love having grains like rice and quinoa with your meals but it takes too long to cook, freeze them in portions and heat them up later."
9RO83PiuQ-A,"if you don't like cooking and washing dishes but still want a delicious meal, then make a one pot meal in your rice cooker. I'm a dietician and welcome back to realistic nutrition tips. this tip can be extra helpful if you're a college student, someone with limited kitchen space, or even if you're an elderly person who can no longer use the stove."
dI-Be4IehyQ,"you've heard of sheep pan dinners, but have you heard of sheep pan breakfasts? just like any sheep pan meal, there's less cleanup because everything Cooks in one place, and for me, breakfast feels extra satisfying when it's Savory, hot and freshly cooked. so this has become a go-to, especially since it's a lot easier to prepare than it looks."
O_7ZvwhzqGg,"if you like salads but hate preparing them, this video is for you. a few months ago, I posted a video about using a veggie Chopper to make a salad box. in then I've gotten a lot of messages from people asking about what different salads to make."
Nq0cKpBQq-I,"I'm a dietician and this is what I atat for breakfast. this is truly one of my favorite things to make. first, crack two eggs into a bowl, mix in 3/4 cup of water and a pinch of salt SC into a bowl and cover with Saran, Wrap and steam for 12 minutes."
y6Z8a0CXfuI,"let's make a side dish for our Thanksgiving dinner. I haven't spent Thanksgiving home in Hawaii in over 10 years, but tonight I'm going to the next best thing, which is my childhood best friend's boyfriend's familyes, friend's house. and it sounds confusing at first, but my best friend, who I've known since elementary school, started dating this really nice guy who's really nice family happens to be Japanese and from Hawaii."
2lnzGCLgYyk,"for years, I struggled to eat meals because, even though I had all of the ingredients for a meal, I just didn't have the energy or capacity to put it together. not just because I had untreated ADHD and lacked the executive function to do so, but also because I was depressed. what I'm about to tell you is something that helped me get out of my slump."
vwOTxAGg_CY,"if you like salads but hate repairing them, this video is for you. I'm a dietitian and welcome back to realistic nutrition tips. instead of taking the time to chop everything individually, just add everything to a veggie Chopper and don't empty it along the way."
3Ql8lfCMEIg,"I'm a dietitian and I'm having dinner nuggets for lunch, and I'm gonna tell you why. welcome back to the series where I show you what I'm eating and why, and I can already see the comments saying: Kylie, you're a dietitian, why are you eating dinner nuggets? that's so unhealthy."
ZD21rjVPpl8,"if you hate meal prepping and love miso soup, then you'll love this. I'm back with another mason jar noodle recipe and this one is, as you may have guessed, a miso soup jar. first add red miso- is your base."
cME3DsSKKPk,"I saw someone turn this yogurt cup into this really delicious looking snack that apparently tastes like a Snickers ice cream bar. so today we're gonna try it. so first get your vanilla, Greek or Icelandic yogurt and mix it with peanut butter."
No-g-ZcjXNA,"if you're like me and struggled putting dinner together every night, get one of these. I'm a dietitian, and welcome back to another episode of realistic nutrition tips. today we're going to be making a delicious meal in five minutes and we're gonna do it by steaming fish and veggies in the microwave."
HZcC-NPSXis,"let's check my bag for a hike today. there's one thing about me: it's that I'm the person in the friend group that brings everything that anyone might ever need. and it's not just because I'm a Virgo and I plan everything in my life, but also because it's one time my friend, who's very athletic and spontaneous, picked me up one day and told me we were going on a chill hike and that I didn't need to bring anything, even water."
ieJ9BbTyvSM,"when my grandma was diagnosed with Alzheimer's three years ago, I was living five thousand miles away in Boston. I immediately moved to LA to be close to my family in Hawaii, to see her more often and help out as much as I could. I think everyone knows what Alzheimer's is, but no one prepares you for what it truly is."
7SFs3rCqc30,"I'm convinced that I've made the best Trader Joe's sandwich and I've been eating it non-stop. I'm a dietitian and this is, honestly, the perfect work from home lunch, and today I'm going to show you how I make it. this is everything you're going to need."
NXJxsV41ZmA,"I'm a dietitian and I'm meeting spam for lunch and I'm going to tell you why. welcome back to the series where I show you what I'm eating and why. I was born and raised in Hawaii, where spam is one of the most popular foods, but when I moved to the mainland I was told that spam was a gross canned meat that I should completely avoid because it's unhealthy."
X09MisWUHJY,"what I ate in a day in New York City. I started off my day with my favorite meal in my favorite place, Raku. I got a quinceanero dawn with extra wakame."
i3qjdX18Quo,confession. the idea of cooking a whole meal from scratch every night is so overwhelming. so this is what I do to make busy weeks easier.
0a790Ti63Gw,"today we're trying the viral cucumber pepper snack. I'm addition and this seems like a fun way to eat vegetables, so I'll try it out and give my two cents on it. all you need are cucumbers, mini sweet peppers, add both to the Bowl, add some ginger dressing, everything but the bagel seasoning and chili oil."
07yNw7rMFWs,"as most of us know, I have ADHD and this is my simple trick for getting in more veggies throughout the week. I'm welcome back to episode 10 of realistic nutrition tips. make a vegetarian that you can eat."
IbsXsI9rtAk,"so people have been making ice cream out of cottage cheese. I'm a dietitian and we're gonna try it out today. first, you're going to take a container of cottage cheese, some strawberries, some honey."
29NFFYP6ETY,welcome back to the series where I show you one week of dinners you can make with one grocery list. for our last day we're making a 30 minute garlic herb salmon dinner. the best thing about this meal is that you don't have to wash a lot of dishes afterwards because everything goes on the baking sheet.
ft45mlqPlEM,"welcome back to the series where I show you one week of dinners you can make with one grocery list. for day four, we're making one of my favorite go-to dinners. when I'm feeling lazy, I need a home-cooked meal in under 15 minutes."
VGmnwkepgMI,"if you're trying to eat healthier but are overwhelmed with meal planning, welcome to the series where I show you one week of dinners you can make with one grocery list. for day three, we're making a chicken orzo Bowl. First, You're Gonna marinate your chicken and then cook it on the stovetop and then in the oven."
Lo5Xu-8DUN4,"if you're trying to eat healthier but are overwhelmed with meal planning, welcome to the series where I show you one week of meals you can make with one grocery list. for day two, we're having my five minute Sesame garlic tofu. all you need to do is make this sauce with these ingredients."
Y0s6IbUNgfI,"if you're trying to eat healthier but are overwhelmed with meal planning, welcome to the series where I show you five simple dinners you can make with one grocery list. for day one, we're making a one pot chicken pesto pasta. first, you're going to season and cook your chicken in a pot."
m3Xb36V_2vM,let's make breakfast for my friends. I met them on the Internet a little over two years ago and we've been texting and FaceTiming since. we've been planning this trip for a while.
rR1QQZxPDpw,"let's make kimchi. first you're going to sprinkle salt on each leaf, heat water and sweet rice flour until it starts thicken into a paste or porridge. add your porridge to a bowl, then add garlic, ginger, onion, salted shrimp, fish sauce and gochugatu, and now we're just going to mix this."
zfP9yZAgeLY,"this is one of my favorite meal prep tools. I'm a dietitian and welcome to episode 9 of realistic nutrition tips. instead of freezing your soup in larger batches, can be easier to pour them into these portion one cup silicone molds so you can easily pop them out and heat them up for a convenient meal when you're too lazy to cook."
2b9z_FwwDlE,"I'm a dietitian and is what I ate for breakfast. if you love a hot saver breakfast but don't want to spend more than a few minutes cooking, try the spring chicken, bone broth, kale and mushrooms to a boil cover and reduce heat to medium for a few minutes, adding quick oats and optionally nutritional yeast, and let's sit for one minute. squeeze some lemon juice on it to balance out the flavor and you could top it with hemp seeds for more healthy fats and protein."
yJspQI7XeoE,"I'm a dietitian and I'm having frozen waffles for breakfast, and I'm gonna tell you why. welcome back to the little Series where I show you what I'm eating and why. before you say ill Kylie, what dietitian eats waffles for breakfast me?"
fmU41Ymn86Q,"when I was 13 I briefly had a crush on a guy who was really into football, so naturally he asked if I like football. I wanted him to like me. so I said, oh yeah, totally."
wTGLwZXJ8kI,my stomach is not having it. today we're making my favorite IBS friendly meal- also one of my favorite meals even when I feel 100- and it is so easy. let me show you.
PNTmE9wiJB4,"last time I showed you how to cook frozen green beans, so today I'm going to show you how to roast frozen broccoli, specifically how to prevent it from getting soggy. toss the Frozen Flora, some olive oil, salt, pepper, garlic powder and paprika. then space them out on a baking sheet."
7cqh6oOLuao,"I've been seeing videos of people making sorbet out of frozen grapes, So today we're going to try to do that. all you have to do is add Frozen grapes and a little bit of lemon juice, and all we have to do is blend this. this is what it looks like."
FQSPN88ZnAk,here are foods I would never buy as a dietitian. I wouldn't buy this because I prefer the barbecue chicken pizza much more. I wouldn't buy this because my mom had a blueberry waffle face when I was a kid and I ate so many that I can't even look at them.
DKbanV5SCxs,"and this is episode 8 of realistic nutrition tips. instead of buying fresh produce and having it go bad before you finish it, let me show you how to cook some frozen veggies. today, I'm going to specifically show you how to cook frozen green beans."
kEOu0kEMFTo,"I like protein bars, but I love my no-bake chocolate peanut butter protein brownie even more, because not only do they have 10 grams of protein, but they're so delicious and so easy to make. let me show you how to make them. you're going to mix together almond flour, two scoops of chocolate protein powder, a fourth cup of cocoa powder, 3, 4 of a cup of peanut butter, one and a half tablespoons of maple syrup and two tablespoons of milk."
DxFc-CWBu_g,"so I saw a video of someone who was toasting their tofu. So today we're gonna try it, but instead of putting the tofu directly in the toaster, like the person was doing, I'm gonna use these reusable toaster bags so I don't cause an electrical fire. I'm using extra firm tofu and I patted it down to reduce moisture, so now we're just going to put it in the toaster."
R2VK5UM6_xQ,"I'm a writing and this is episode 7 of realistic nutrition tips. you can start today- and this is specifically for all my past lovers out there who hate doing dishes. if you're making pasta and want to include a veggie in your meal, add it to your pasta while it's still boiling."
qjpohStyejU,"this is my super easy and quick 30 minute dinner. just kidding, it took two hours, but did you believe me, like how I believe the food blog that told me this wouldn't take longer than three minutes either way? this is my hiya for dinner tonight, and I wanted to specify that because I always see posts of what people make for dinner and get confused as to how they had the time to make all that food, and sometimes they actually go through the effort of following the recipe and I still end up with a Sapar dish."
96w2vyH05-g,"I'm a dietitian and I'm also technically a nutritionist. however, not all nutritionists are dietitians. let's talk about the differences between the two, because there are big differences depending on what country you're in."
FnxEWjYEj_4,"so apparently, heart of palms is supposed to be a healthy, low-calorie snack that resembles string cheese. I'm a dietitian and today we're going to try this and talk about this. this is what it looks like, but you can just peel it apart."
psLBKgXQppY,"I'm a dietitian and this is episode 6 of realistic nutrition tips that you can start today. if you want to increase your protein intake, add bone broth to your rice or quinoa when cooking. one cup of bone broth has 10 grams of protein."
QG6-FQ2U7WI,"I always thought I was lazy, but it turns out I just had ADHD. growing up, I always looked at other people's meal preps and Healthy Lifestyles and, as a dietitian, I thought there must be something wrong with me, since my life didn't look like that, especially since my life is supposed to revolve around food and healthy eating. so I decided to post easy meal ideas and nutrition tips that were realistic for me, in case anyone felt the way that I did."
8US8t96-WEE,"hot take, but breakfast is not the most important meal of the day. dinner is well, at least for me. I look forward to dinner because days have gotten to be overwhelming and dinner is one of the only times I can actually allow my brain to shut off, even if just for 15 to 30 minutes, to enjoy a filling in a hopefully delicious meal while I watch my TV shows or YouTube videos."
qzVuvyn4w6Q,part two of foods I would never buy as a dietitian. I wouldn't buy this because they're much more fun to eat when they're shaped like dinosaurs. I wouldn't buy this because I ate so much of these as a kid that I almost vomited and now I'm scarred.
uCm007BPvPg,"I'm a dietitian and is what I eat for breakfast, and I promise this only takes five minutes. I cooked quick oats with soy sauce and grated Ginger. after a minute I removed it from the Heat and stirred in white miso."
TQLTuAPMJtc,"I'm a dietitian and this is day five of realistic nutrition tips. and this is more related to cooking, because sometimes the key to good nutrition is taking steps to learn how to make home cooking more manageable. so whenever you're preparing vegetables, keep a mini garbage can or bowl next to you."
z_2PiGgCYIE,Euro Foods I would never buy as a dietitian. I would never get this because chocolate cake is much more delicious than red velvet. I would never get this because I'm extremely lactose intolerant and will have diarrhea.
H0f4_XHNRNs,apparently the raw carrots out that I'm about to show you is supposed to balance hormones. I'm a dietitian. let's see how it tastes and talk about whether or not this works.
SFLfz3K_21A,"let's make a dish for a cultural food party, so we're all supposed to bring food from our own culture and I really thought about this because, although I'm Japanese, being from Hawaii is obviously a big part of my identity and it's so underrepresented, given how small the population is. so I decided on show you chicken, given it's a Hawaii dish with Japanese flavors, and also because it's easy to prepare and there's going to be around 20 people there and I feel like everyone deserves their own dye, which means I have to cook 20 thighs. so I have 10 dies in this pot and 10 dies in this pot."
lExxiSII-lA,"do you like smoothies but hate cleaning it? let me show you this easy trick: instead of soaking this and then just not washing it until hours later, pour some water and some dish soap and blend, and now all you have to do is dump it out. personally, I'd scrub this again."
nsN68mzmPrw,"I'm a dietitian and this is day four of realistic nutrition tips. if you're like me, the sheer idea of gathering ingredients for smoothies in the morning to make a smoothie can sometimes be overwhelming, so I like to make it easier for my future self by doing this. it's as simple as portioning out your ingredients to freezer friendly containers."
AkrXs5WxjT0,"meal prepping can be hard, so let's prep my easy mason jar noodles. let's add the base first, which is chili, garlic oil, soy sauce, sesame oil and vegetable better than bouillon. then add kimchi, snow peas, shredded carrots and bok choy for veggies and Tofu for protein."
27IqAin0tYw,"I'm a dietitian and these are mindsets about food that need a change in 2023.. I saw someone do a video on this and really enjoyed it, so I wanted to do my own version. just because something is non-GMO doesn't mean it's healthier."
z9ZwQVUIIkE,"what I did on my last day home in Hawaii. first, I went to the kakaako farmers market to shop local walk around and eat. I got a steamed bow bun, which was so good."
SF9LzyUK5OQ,"every time I come home I visit this Indian vegetarian restaurant. I had a close friend pass away unexpectedly a few years ago and she used to share places. she loved the people she loved, and this was one of the places that she shared with me and the rest of our friend group."
ACzq2lsX2k8,"as an Asian American, I feel conflicted about my culture, and not because I'm not proud of it or anything, but because I feel like there are aspects of my Japanese and Okinawan culture that I'm not even familiar with, since so many Asian immigrants, including my ancestors, came over to Hawaii to work on the plantations 150 years ago. most Asian people in Hawaii aren't first-gen and, as a result, there are parts of that culture that are just lost along the way. in my case, we don't prepare an entire ossechi, which includes all these Japanese New Year's meals, though we do prepare parts of it."
vH4le-bGWtc,"let's make a Japanese New Year's dish together. namasu is an easy vegetable side dish that takes very little time. first, peel your diet cone, then peel your carrot."
4zcFowmtEQw,"let's make an easy dinner while I'm home in Hawaii. this is honestly one of the simplest recipes and it takes less than 30 minutes. today we're making teriyaki chicken, which is a popular Japanese dish that's commonly served in Hawaii."
EJiJmk7Jwho,"everything I ate in a day while in Hawaii. first, I had this breakfast: bibimbap with carrots, bean sprouts, water, spinach, kimchi, mushrooms, egg and rice, and this was so flavorful and the perfect way to start my day. for lunch, I had to show you Aji poke bowl with rice and a salad from FoodLand."
QGor7f96ai8,"I'm back home in Hawaii. let's make chapty for a Christmas dinner today, making chopje, which is a popular Korean dish with vegetables and noodles, and I really wanted to make it for my fiance, Alex, whose favorite dish is chop Jay, and for Alex's Korean Grandma, who is also going to be at this Christmas dinner. I remember meeting her for the first time over seven years ago, and she brought chopche to my very first Christmas dinner with her family."
-UZpmlhPiR0,"everything I ate on my flight home to Hawaii. for dinner I had this garlic pesto and diced tomato, chicken bagel roll with Maui style chips and a Honolulu Cookie Company cookie. The Bagel rule is fine, basically everything you would expect, but I did love this cookie more."
n7GoqHolyLk,"what I ate at the unforgettable Gala, which is an annual Gala that celebrates aapi leaders like simulu, Batman Rock, Sandra Oh, Stephanie Shu, Chloe Kim and many more. first, I started off with this delicious Sesame salad. honestly, any salad with Sesame automatically wins in my book, and bretman himself even said it was so good."
Nq2NqlazqBA,"let's make food for a picnic. let's start with preparing our tuna. speaking of tuna, I used to hyperfixate on tuna sandwiches from Subway as a kid and I would always get the worst stomach aches after eating them."
EcUmgWbzMmU,"I'm a dietitian and this is what I eat for breakfast. first I boil my eggs for six minutes and then transfer it to cooled water. then I mix together soy sauce, water, garlic, honey, jalapeno, pepper, green onions and sesame seeds."
HtmeDIp4QhY,"I'm a dietitian and this is day three of realistic nutrition tips. if you can't stand cooking and the idea of cooking vegetables stresses you out, get one of these to microwave steamer and it's going to make your life so much easier. all you have to do is put water in this compartment, put this on top on top and then put your veggies on top."
Hx5LMQdtmK8,"how I get my hair from this to this with no heat. first I put my heatless curling rod on my head, then I roughly divide my completely dry hair into small sections and wrap each section around the rod. I work my way down and tie my elastic tight around the rod, then just do the same thing to the other side."
IfGp016IaBM,"I'm a dietitian and this is what I eat for breakfast. if you crave something Savory in the morning, this is for you, because I'm making Savory oats. yes, oats can be Savory and they're so much better this way."
8gIWivpcAfw,"so apparently, grapes tossed in lime juice and Jello powder are supposed to taste just like sour candy. I'm a dietitian and we're gonna try this out, so I have washed grapes here and now I'm just going to coat this in lime juice. so now I'm adding the strawberry jello powder to this container and the orange yellow powder to this container."
6shs5fSofi8,"I'm a dietitian and I have IBS. let's get my IBS friendly meal for when I'm not feeling well. first, let's make the marinade for a chicken."
C7WP_oNlwXM,"I'm a dietitian and I'm eating instant Ramen for lunch, and I'm gonna tell you why. welcome to the little Series where I show you what I'm eating and why, before you say, oh, this is so processed and so high in sodium. I would never then don't, but I will."
ksCHUIWJdOM,I'm a dietitian and here are three foods that I'm avoiding this Thanksgiving. one: cherry pie because I don't really like the taste and I strongly prefer pumpkin pie. two: mac and cheese just because I'm painfully lactose intolerant and this would send me into an IBS flip.
IP0bxHmNzp4,"let's make cornbread for Thanksgiving. I didn't like cornbread much growing up, but then I had this cornbread. I always associate it with my grandma because she made it so often and since she has late stage Alzheimer's now, it makes me remember the times where she was able to cook, eat, talk."
mLboOEwl1yA,"let's make a friendsgiving dish together. Thanksgiving used to be my favorite holiday growing up, but when I went to college it suddenly became the holiday that I liked least, mostly because, as many of you know, I went to school in Boston and I could not make it home to Hawaii for Thanksgiving. my freshman year, this girl was like, oh, are you going home for Thanksgiving?"
LaxZ1MN_HII,"are you constipated? well, apparently there's something called an internal shower, which is a drink made of water, chia seeds and lemon, and it's supposed to naturally relieve constipation, just like that. I'm a dietitian and we're going to try this out."
4aJ0gHbis38,[Music]: hoes going back. [Music].
76xHImc2-qc,"I'm a dietitian, and let's me apart for the week. in under an hour we're going to start with making some rice. now we're going to cook our chicken and I promise the next steps are super easy."
7aQFot1gb0Y,"so I could get my first two surprise bags from. too good to go. I feel like I've been seeing this all over the Internet recently, if you haven't already seen those videos."
NnQRppljPtk,"I spent an afternoon at the LA Google YouTube office and here's what it looks like. I first got lunch with Mary Jo, my partner manager at YouTube, and Brittany, my manager. they did so many delicious food stations and everything was free."
1aHZX6UNVts,"so apparently, Frozen Cool Whip is supposed to taste exactly like ice cream but be lower in calories and healthier. I'm a dietitian and we're going to try this out. I have nothing against Cool Whip, but it's still not ice cream."
pDxmaka1kwk,"really, what's your major? oh, it's mathematics. wow, you're so smart."
ck6YJBDgavw,"I'm a dietitian and I hate meal prepping, but today I will be trying again, so let's me open my lunch for the next few days. I personally find meal prep overwhelming, especially when I'm trying to find meals I like and not get bored of them. but I'm hoping I can figure things out in this series- and hopefully you will too, because I'll include everything I made in each video."
GUAf4qm-vKM,"I hate meal prepping, so let's make super easy: gochujang, Sesame, mason jar noodles that require minimal effort. add your base first. mines is better than bouillon."
5mfqCV9X4F8,"is not chicken, it's actually shredded tofu, and this barbecue pulled tofu sandwich I'm making is really easy and quick to prepare. I just tossed it with a sauce, baked it and heated it on the stovetop with barbecue sauce. pair it with your favorite coleslaw and some fries, if you want, and you'll have an easy, delicious dinner."
fhiYTPE4aKQ,"I'm a dietitian and what I ate for lunch. add rice to a sheet of nodi, then sliced cucumbers, some tuna mixed with sriracha and mayo and sliced avocado. top with another thin layer of rice and fold into a square wrap."
