Video ID,Transcript
zqdxQWTdIM4,I'm going to show you the absolute best natural vitamin for arthritis and it's not vitamin D I took this for a different purpose and then I woke up and I'm like why is my neck so loose
aYV9EWaiz_Y,I'm going to give you three tips to help you lose more weight while you're sleeping and by the way if you don't burn fat when you're awake at all and the last tip is going to be the most important tip number three let's go
G4guVvCYAEA,the absolute number one most inflammatory food in the world is ultr processed foods now this is a group or a category of foods composed of primarily
u0-U3-f4VHM,you know if you went to your kitchen right now and looked in your spice rack in your cupboard you probably would have this right here this is called ginger right well did you realize that Ginger
llDg68l626M,all right we're at our favorite restaurant KFC and let's see we got we have uh these things right here let's see if it bounces yeah it does all right
OahN4mwd6C4,now think about what breathing problems involve right the diaphragm so you here you have this gallbladder /b duct issue congestion whatever you want to call it
VghsZO9QO_M,so right now in your kitchen in your cupboard you probably have this right garlic powder this is like a natural remedy for so many different things okay
9tHeg6Iq1kk,there's this carb that is way more dangerous than sugar okay now people tend to think sugar is the worst thing but there's other things that are even worse than sugar and this specific carb
AD2sPmVxcwU,zinc is involved in so many different things it's involved in 300 different enzymes and over a thousand different factors related to your DNA its
IjQJkjrXCC4,I think you already know that stress can also cause disease too right it can cause ulcers heart attacks it can cause osteoporosis it can cause high blood pressure it can cause anxiety depression
L59jXhtPvNM,all right today we're going to talk about Burger King and the impossible burger that you can get for $6.50 so the first ingredient is this
A2x33zFsTLA,my terrible painful heartburn was the best thing that ever happened to me there are three things to do but one of these things that I'm going to share with you will actually correct it let's
afWHeLiejPY,to lose your belly fat there are three tips that you need to know relating to doing intermittent fasting and one of these tips is way more important than the others tip number one make sure you
ntQ5IbULu7U,if you have any inflammation on the right side of your body okay I don't care if it's fibromyalgia or shoulder pain or a headache on the right side or anything down in the lower part of your
W_8nrFXzw_4,if you are deficient in calcium you may find that you have this chronic cough okay and you may find that um you're tired but you just can't go to sleep
pY1fV-P1YnI,you know I talk a lot about vitamin D but I wouldn't recommend taking vitamin D by itself I would always take vitamin K2 with vitamin D because vitamin D3 increases calcium absorption in your
6nnp1YJF1OA,all right so today we're at one of my favorite restaurants paries okay so today we have some fries which is a great combination between soy or corn
DavA5kfaqaU,you know so many people have blood sugar problems they're worried about their diabetes pre-diabetes Etc well in your cupboard right now you probably have an amazing remedy it's in the spice rack
nqpMzWGPxHo,if you can't sleep right you're getting less than 5 hours and you have this sympathetic overdrive and you're trying to lose weight good luck it's not going to happen in fact you can work with
o_SS8cGGFbI,so you have the spine you have all these different ribs that connect to the spine but this articulation between the rib and the spine and your back if it's
yUNWFEiJb6I,all right rabbit D today and we want to talk about these right here um man are these addictive so you have a combination of different oils they're all seed oils corn canola soy soy
z4Lx1x6mNVc,what does acid reflex or silent reflex have to do with your breathing well apparently there's a lot of um sensory nerves in your esophagus that go right to your brain and that will give your
D318YEnHPeg,so I recently did a video on how to get rid of a wart or a skin tag using this amazing amazing remedy that I just
lCHoCeUdoII,what does acid reflex or silent reflex have to do with your breathing well apparently there's a lot of um sensory nerves in your esophagus that go right to your brain and that will give your
FJj5mY2KS2M,so I have a question for you when you're at the grocery store and you are at the tiny little corner of the store called the health food section what does that
vSMmAjFCP4w,I'd like to talk about vitamin D and magnesium okay did you realize that the receptors for absorbing vitamin D are completely and utterly dependent on magnesium if you have no magnesium you
f54Fr1Nidaw,want to show you how to make the healthiest lemonade in the world now why is it so healthy because it has zero sugars most lemonade has like 7 and 1/2
U1dEuvAFTNU,When you sweat uh it's really salty and then also if you're drinking a lot of plain water without salt you're just going to create a situation where you're going to actually be very deficient in salt just as a side note one of the
seoNCxlrmM0,I want to discuss the top mistakes that people make when they start intermittent fasting number one eating way too much what you have to realize is that when you're not eating you are eating you're eating your own fat so it's not that
Nrl_X5wE0uw,I want to discuss the top mistakes that people make when they start intermittent fasting number one eating way too much what you have to realize is that when you're not eating you are eating you're eating your own fat so it's not that
vDa8341QhNw,so I wanted to respond to an article um on how OIC in wovi could break the Health Care system because now if you have these weight loss drugs that are actually helping people lose weight and
Hz6EBeJP3vI,there's even a condition called e a that's a condition where the person is water logged okay and it's creating a lot of swelling in the brain and that could easily come from just drinking too much water and this often occurs when
RW7STOpaRvg,you know the other day I was shopping at the grocery store and I bought this right here keto friendly Duncan hindes chewy fudge brownie mix right is it too
6jSpyG0rRT0,so I have a question for you if you can answer this out of all the ingredients to ultrapress Foods or junk foods which ingredient out of all of those is the absolute worst and has the biggest
QifjPgYfIiE,takes is just a little bit of exercise to produce significant health benefits and I'm talking about lowering your risk for certain diseases and increasing your longevity living longer it doesn't take
aT0rBaHMRns,did you realize that 71 to 83% of all the calories sold in the grocery store are what's considered ultr processed
iwsdIX0_qK4,now you may just end up quitting sugar after watching this video I'm just warning you don't get mad at me I'm just the messenger there are 703 meta analysis that make up 8600 different
oEvhzW_lbTM,"so there was a quite large study there was I think over 80,000 people involved in this study called the nurse's health study and they looked over four years of who gained weight and who didn't gain weight and they looked at variables and"
fbIz1ozqRYQ,[Music]
Y8XQNFyMe8M,what is the number one best anti-inflammatory food in the entire world can you take a guess you think it's omega-3 Fetti acids fish oils not even close there are so many things that
KD2zUbWrkAM,all right another Factor that's very important is the frequency of eating okay if you're snacking if you're eating between meals if you're even eating three meals a day that can slow things
wi6SHudf2PY,there's other things that cause a deficiency of biotin that you need to know if you consume raw egg whes because it locks up biotin if you're on the ketogenic diet your demand for biotin
32K_bo7E66M,foods that create the most inflammation would be related to something like gluten which actually is in grains most of the grains create inflammation in your gut most people with arthritis
Kfn7YpAlmPs,now I hate to break this to you but that mother and the oppsite of vinegar and the bottom of the bottle is not what you think what you've been told it's a
Ba6QLhycpy8,[Music]
_achdhdxIH0,developing more Fitness also improves your insulin sensitivity so if you had insulin resistance at one time developing more of a fitness Reserve can greatly help your blood sugars and allow
gO0mUN3MAoM,if you wanted an amazing drink to drop inflammation in your body especially inflammation in your gut here's the best drink and this is based on a YouTube video that I did recently but I will say
3BbcD0fjfno,so I'm really excited to speak at the upcoming Health hacking event forly called ketocon and so the topic of my uh presentation is going to relate to the
9vBO3ejBoMA,my fair share of bumpy roads and heavy winds that's what made me what I am today now I stand here before
Ika6xrj1L40,really got to be careful of these grains uh and consume only grains if you're going to do grains at all that have no gluten and that would be oat quinoa
8JySMhsH72M,does drinking water actually hydrate you the answer is it depends it depends on what's going on with sodium if you have a lot of sodium in the body and not enough water you're going to be
xsvsonsP3BU,ketogenic diet can absolutely kill you this is Steven L lifestyle medicine cardiologist and in this video I'm going to tell you that the ketogenic diet can absolutely kill you we're going to go
EmGwQA2C1UM,one of the most important nutrients for your hair is a simple amino acid called Lucine without Lucine you can very easily develop alopecia thinning of the
JeaF9HtuVxA,now the second point about probotics is we have to talk about the opposite of a prootic which is an antibiotic um there are things out there that mimic antibiotics as well like glyphosate
QEzFBI-Z7qY,so there's a certain amount of sugar that you have to put in certain foods to optimize this Bliss moment this point of like wow this is just delicious and what
z-atfvHSsqk,there are many uh non-pathological reasons why you might have high blood glucose that don't indicate that you really have diabetes or a problem for example if you test your blood sugars
g3zWxCcBeOY,if you want to know the most poisonous foods on the planet and I'm not going into sugar refined carbs and Seed oils which we know create more problems than any other food now mushrooms are very
2PaIdKUPDkI,hey just want to let you know that I'm going to be speaking at the keto Summit in Florida coming up in January it's called Symposium for metabolic Health it's in boa Raton Florida January 12th
Qk_bJoj8f-E,really interesting thing about a diabetic on a good portion of their high blood sugar it may not be 100% from the diet in fact it's not a good portion of
rs6Ztq7YrpE,now if you want to get more energy you want to focus in on this amazing cell in your body called the mitochondria the mocher is a pre- battery machine it
B1D7bjFMPC4,people that have a slow metabolism actually have a very efficient metabolism probably from dieting in the past you go on some diet and then your
1RRwbp9YMLA,did you realize that the average person in the US consumes like 60% of their calories from Ultra processed foods where they strip the
5EnsvmwexjY,now vitamin A is very very important in your eyes for your immune system and for your skin not just external but internal skin too the skin that aligns the inside
cydV-nZEyk4,I'd like to talk about the amazing benefits of magnesium so magnesium actually helps you lower cortisol so it helps you sleep especially getting to sleep as well as staying asleep
Bz3DLaEF-ec,so I started looking at Copper in relationship to the satic nerve and I found some fascinating information number one there's all sorts of different types of therapy that use
xyNjoCrJW54,the pH in your stomach should be between one and three very very acidic and the purpose of that acidity is to help you break down protein is to help you absorb minerals also uh absorb
lbdYjujrBTA,to remove fat from your liver just drink this one cup every single day now I know you're saying no freaking way is this going to work but just hear me out it'll make sense most of the fat on our livers
nTXr3WH033Y,next topic is about carbohydrates if you do a workout and you do a little snack before during or after the workout like a lot of people do they want to get those carbs in there maybe they do a
vH0rhTPEShI,sometimes people when they get on the ketogenic diet they feel that the muscles are just flat they kind of lost their size they look dehydrated because um when you do keto at least initially
tbAmKJecACA,you know slightly older people that were born in the 50s and the 60s like myself notied that there just wasn't as many overweight people back then why is that was it because we ate less saturated
PF1siw7tXeY,so these microbes from kefir actually go into the body and they inoculate or seed your microbes to help you grow more microbes and actually the right balance
HR2ogA32znQ,now as you see when you buy biotin supplements or you see them in certain shampoos you'll see very high amounts of biotin now is that a problem uh not necessarily because biotin is water
4UFJDlYNraw,insulin is really necessary it's a normal hormone we want it normal we don't want it too high or too low and unless you're a type 1 diabetic and have
R34IcLIgaaA,now I've been experimenting with this and I found that I'm getting a lot of recovery after I do uh this cold water immersion I have this unit that I jump
qhv0_0n6zHw,so you probably heard of this Mediterranean diet being a healthy diet right um yes it might be true but what is not true about it it's not a
qqIAnbIL2J4,the beneficial bacteria and yeast in kefir can help break down the protein in milk like casine and other proteins into
hKXNgZe6AHY,to help you lower your blood pressure I recommend drinking one cup of this every single day now before I tell you what this is I highly recommend you also get on the ketogenic diet make sure you have
iD4MYygfrvE,what OIC does to the body is it increases a certain receptor called glp1 which helps slow down digestion thereby
FK6etkdOgm8,so these people that are cutting out red meat they maybe doing chicken breast which has way too many uh omega-6 fatty acids and it's definitely of lesser quality and so is like plant-based
LNguvTPcPMs,when you're in a room when the windows are not open and you're not getting enough oxygen because maybe you don't also have enough plants in your room which give you oxygen you may have a
YNVUc65A1sQ,you know there's some interesting root causes of sleep problems that you may have never considered before one is something related to sleep apnea but it's not really sleep apnea it's a situation where you just don't have
b-0oVmjfiEU,there are several very important mistakes that people make when they do intermittent fasting the first one is not doing the ketogenic diet with intermittent fasting and so it's going to be really hard to get into keto
jt1oERGNgzU,there's a condition called air hunger okay or another word for it would be dpia which is a situation where you just don't get enough oxygen that can create anxiety and typically people know that
TeEO1ng3iuA,so realize when you eat sugar you're kind of paralyzing your immune system and also when you eat sugar if you're female you're increasing your androgens okay that's there's a condition called
0rNBpyk_qmw,now if you're not consuming apple cider vinegar you might want to start let me tell you some of the benefits number one it helps insulin become more sensitive in other words insulin can now work
m-lAMiyRr9w,now listen when you're trying to lose weight many times people have this idea I'm not exercising enough maybe I'm eating too much or maybe I'm just getting older or it's genetics those are
W04hrjwuz_U,trying to figure out how to State this um there's one thing that we know for sure about dopamine no one really understands the complexity of dopamine
GsGEckgi0S0,now there are several ways to get probotics without taking a probiotic supplement so number one you want to consume fermented vegetables as in pickles sauerkraut or kimchi number two
M73Bm3tBteU,is this true or false one out of seven teens has either high blood pressure or elevated blood pressure what do you think well the answer is
-L1FScy3Jtg,now sulforaphane is a very powerful phytonutrient that can help in cancer anti-aging it's a very powerful anti-inflammatory but the question is
Deihn1FxlAk,did you realize that soda can actually melt your bones i recently did a video on this and there are three things in soda that you need to be aware of number one phosphoric acid which is an acid
_hTrFvFCnrg,did you realize that virtually all the cellular estrogen and men and women come from testosterone and so there's a certain enzyme called aromatase that converts testosterone to
Cc7xoNMaE4E,i want to just talk about hpv human papilloma virus which happens to be very very common 80 of sexually active adults have this virus and it's linked
7RpuR_GBn-g,i had a question recently from someone that wanted to know is it okay to do keto and intermittent fasting if someone's pregnant or lactating and the answer is
9H8RY8umqnI,now take a while to guess what part of the world is mostly deficient in vitamin d if you guess the middle east you are correct and it just so happens if the
hTUDMmCEYnU,so i have a question why do you think consuming high amounts of carbohydrates make you sleepy well if you answered high levels of insulin you are correct
Ldy8Z93qp7s,i did a video on this amazing exercise for shoulder pain the best exercise for shoulder pain is simple stretching on a pull-up bar okay with your hands going
rTyyc1oh1uc,all right so here's a question someone want to know can a chili pepper because it's so hot put me in thermogenesis and actually help me burn fat well yes or no it really depends on if the person's on the
LoFYyyFut74,you know i had a question from someone relating to that white ring around the eye they were a bit older and they wanted to know what the heck was going on with that and the answer is this it's very normal to have that white ring
IkzEtWNfOiQ,i want to tell you why europeans have less bloating when they consume wheat products than people in the u.s and it has to do with three things one
CXFKvgJI0PI,[Music] come on we're all gonna die of something
aWvqtgi65q0,can you guess what the biggest deficiency is in inflammatory bowel disease now if you said iron you are correct then vitamin d
LgpAB9SCGjA,i have a question out of all the foods out there what has the highest amount of phytic acid now phytic acid is that compound in food that blocks minerals like zinc
Fv4yH_Z4VbU,the most common reason for pain or tightness in the right side of your neck and shoulder is a gallbladder problem and so usually the person is not on keto they're eating
LZ-WdsRDdAc,i have a quiz for you what has more sodium the dead sea salt or sea salt if you guessed sea salt you are correct sea salt has 90
2R4Ua1iMudk,milk thistle extremely powerful in protecting the liver against poison like mushroom poisoning alcohol poisoning tylenol
0PINKb0MyAU,so here's a quiz question for today what is the benefit of chromium what does chromium do in your body if you said anything connected with improving your blood sugars you are correct chromium is
t_F7L81aoBw,all right i have another quiz for you what nutrient deficiency causes nauseousness when you're pregnant if you guessed b6 you are correct
vrx6Khc8x4M,all right here's another quiz for you what nutrient deficiency is most commonly found with IBD irritable bowel disease
DY9v2WhzIKU,all right what's the best exercise to increase your telomeres now the telomeres are the protective little ends of your chromosomes that protect the genes against aging and oxidative stress and so the
amLI98Dv5V4,now if fructose is so low on the glycemic index it's like 19 okay and glucose is so high it's a hundred
nWzU4Kp1DWE,okay so you have two major types of arthritis you have rheumatoid arthritis which is an autoimmune disease and you have osteoarthritis which is usually not considered an autoimmune disease but it
6FK-k05NSrA,all right this is kind of a disgusting topic but let's talk about it anyway what is the significance of green phlegm as in mucus versus yellow phlegm well it has to do
VmAy2MWx2GA,I want to mention how to get rid of knee pain especially if it's in the front part of your knee it's called anterior knee pain and the best remedy is to stretch the
MhKiKALF32k,all right this is an easy quiz question go ahead and type down what hormone determines what type of calories you will burn
oMmoRCQP7kI,all right so i want to answer the question what is the best cheese you could eat now this is a cheese right here from switzerland it's awesome raw milk cheese hormone free here's another one of my favorites
10px_5GVJ_U,should i eat before bed eating before bed can nullify growth hormone now think about it growth hormone is the major fat burning hormone it's the major
BJFqw7OR3Xw,now if you have pain on the front part of your knee or if you've been diagnosed with something called patellar tendonitis the absolute best stretch for that
Ays2lOShuPA,so why is it that some people get herpes simplex one when they go out in the sun now you may have been taught that the sun gives you vitamin d and vitamin d is really good
uOF9ZJ-wG24,i want to talk a little bit about dhea when would you take dhea as a supplement well your body makes it and it's used as a precursor to make estrogen
Cp87NtH2av0,all right so i have a quiz question what is behind a slow metabolism both in men and in women a situation in which you hit a certain weight and you can't seem
2KijtQnDZBk,one of the biggest concerns people have on the ketogenic diet is this fat you know 75 of all your calories should be fat now the reason why you shouldn't be
L0YMGcoXAKA,most people have this idea that the best thing to do for rehabbing a dysfunctional joint or an old injury would be stretching heat ice
ehzVVUNPKH8,did you know what the number one cause of liver transplant is in the united states it's actually taking tylenol and the problem with the drug and tylenol is
vjfVHloosgU,you know there's a really interesting study that i saw recently on salt it's actually a low salt diet that increases your risk for a heart attack so if you're consuming less than just one
DCVx5GQb4gE,so ultra processed foods are not really foods they're highly refined flour products they're very high in carbohydrate very high on the glycemic
cHqWvJmRzI8,now as you know when you buy extra virgin olive oil a lot of it's fake like 80 of it is totally fake and there's a really good way to determine if it's the
Wrv6erc3D7s,selenium very very important in your thyroid converting t4 to t3 but selenium is one of the most powerful antioxidants so take a while to guess what nut has
CghlQS3lQNw,so the question is what's easier to digest mct oil or coconut oil what do you think well mct oil is a hundred percent medium chain
qB5lj50JdqM,you know it takes about 20 minutes to consume two cheeseburgers medium coke and a medium fries which basically is over a thousand calories but it's going to take three hours
KBYWmjWWvUk,now when we're talking about insulin we're talking about your ability to lose weight because if the insulin is too high you're not losing any weight so the goal is to keep your insulin at the lowest level possible so most people
9V-u3u5_FNA,we're gonna talk about the seventh reason why you're plateauing with weight loss number one could be that your carbs are just too high you got to bring them down below 30 maybe even 20 grams of net
sIieJXTOwck,do you realize how many people have a fatty liver but here's the cool thing there's a recent study i did an entire video on this within 14 days in the ketogenic diet you can reduce up to 50 of the fat off of
haQXLosWycE,now what's interesting about your brain it only comprises two percent of all of your weight but it hogs one third of all of your calories it is a energy hog because it uses a lot of
-peCRup97JE,hey guys we're here in our front yard and karen just wants to say something go ahead hi and can you start the grill okay so that was it that's the uh tip of the day that was it i'm having a bad
WtIY5CgsxWk,tips on sticking to it how do i stick to it and i kind of looked at that and i think within a minute of fasting in keto it's a lot easier to stick with it because the cravings go away and you're
6VyjekMgRHg,i want to explain why some of your friends and family members think you're crazy for doing intermittent fasting and doing ketosis well this is why people do not do things they don't understand and
8YHjSVgKRvc,it's about calories am i consuming enough calories when i'm doing intermittent fasting we don't want you to go on a low calorie diet there's a little point that i want to mention that i think will explain why you don't need to do that when you go through autophagy
EYgGGVAw2X8,if you're thinking about doing intermittent fasting and you're hesitant because it's hard because you're not eating there's a couple things you can do to make it easier number one apple cider vinegar with water if you drink
oYjoWw8v6IA,so if i were to recommend the absolute best food for anti-aging it would be eggs but especially the egg yolks okay out of all my skype interviews that i do
SjR9Optt6go,i wanted to explain what causes palpitations the rhythm of the heart is controlled by electrolytes so it's usually a potassium deficiency it could be magnesium it could be a
