Video ID,Transcript
-4eVclrit2o,here's my full day of eating I start the day with some raw milk and maple syrup before heading out to go for a surf after a couple hours of Surfing I'll drink some coconut water to rehydrate
8ayZ4__PiL0,ground beef is humble it doesn't get the praise it deserves when butchers make ground beef they're taking some of the cuts that have more of the connective tissue the parts that we leave out too
K7yxl6IOZBA,plants contain defense chemicals which are concentrated in their leaves stems roots and seeds the things we think of as vegetables this is in contrast to fruit which is sweet and colorful plants
RZq8VnRrvy4,all of these healthy snack bars are full of processed sugars and Seed oils look at this kind thins say they're 90 calories and the number one ingredient is almonds well that's a little misleading when you realize that the
Qf-Zumc3ZO0,I want to show you guys my grocery haul in the U.S it's a little different than Costa Rica went to Whole Foods this morning I got some grass-fed grass-finished rib eyes those look really good I got some raw cheese it's
zuQyKM-HL7o,Diet Coke versus Coke Zero what's the difference neither of these has any calories from sugar most people think they're good for weight loss totally wrong these are both horrible for
BQhI1Q0aEi8,mainstream carbohydrate recommendations versus what I would recommend you eat for carbohydrates the USDA recommends six servings of grains per day this
Ww5lsjwlWXA,the Whole Foods salad and hot bar is a train wreck it should be called the seed oil and harm your gut bar look at this canola oil canola oil canola oil canola
ML96viQZtQI,if you visit hunter-gatherer tribes like the hadza who are our best representation of where we come from as humans their preferences for foods are crystal clear they are Hunters first and
iN4Aa3Z1bIM,I just met some medical students here at the University of Arizona who told me they learned about nutrition and then told me they learned that saturated fat is bad for us because it raises LDL and everyone knows that LDL is bad for your
gYtAuEG0F4w,plants do not want to be eaten except their fruit looking at this banana tree behind me you can clearly see that the only part that it wants you to eat are those bananas once they become yellow
dxDC8W7pyGM,this is what is in every Pantry in America there's absolutely no judgment here but I'm staying in an Airbnb so this is really interesting to see what's in here seed oils extra virgin olive oil
DYq80RoGVlU,here's how much protein I would suggest eating every day on an animal-based diet based on your goal body weight let's start with an example of a 120 pound woman for women I recommend multiplying gold body weight times 0.9 so about 108
fgn6uww_GrM,this is why most diets fail because most diets things like Weight Watchers or any point system of diets fail to take into account the quality of the calories and the resulting satiety the quality of
21H9kSOW2iQ,here are three more of my favorite kitchen hacks don't drink tap water it's full of tons of chemicals and pollutants that you do not want in your body I use a countertop reverse osmosis
1vb-JB8uD2s,RX bars claim there's no BS well I'm calling on RX bars look at these ingredients there's a seed oil in there sunflower oil right there
Cm2PRVJ6OXM,what are the most optimal foods for humans on the planet this is what I believe the most optimal way that you can eat is this is an animal-based diet when I try to think about what humans
THCQna1ngOk,this is where diabetes obesity eczema psoriasis autoimmune disease dementia chronic illness and suffering begin at the grocery store the choices you make
fqGPW2oqNA4,is spinach causing your kidney stones you've been told that spinach is good for you but did you know that spinach is by far the biggest source of oxalates in
Aa9W_MQrpUo,meat and organs contain far more nutrients than vegetables we've been told that vegetables the leaves the stems The Roots the seeds of plants are good for us because they're full of
iUvMvbgqqiQ,this is my favorite way to eat liver which is my favorite organ I've got a bunch of liver in here I've got the liver cut up and Frozen it's in small pieces I'll eat a piece like this every
ke8DDaP4jFQ,it's pretty clear that the animal Foods meat and organs are the center of the human diet when I started looking at the medical literature you find nutrients in meat and especially in organs that have
blqHuxlNAeI,canola oil is toxic here's how it's made it starts with the seeds of a raped plant which are completely toxic to humans in order to make canola oil these plants must be specially bred to lower
iu66Y5vmIH8,if you simply eliminate seed oils processed sugars and processed milled grains and flowers you're essentially not eating any processed foods and your health will improve and the story people realize how hard it is to do that
kmss5-n20po,Ezekiel Bread yay or nay listen guys even though it's seven sprouted grains it still has grains grains are seeds seeds are highly defended they are full of Defense chemicals digestive enzyme
Nxp-fK6zsgY,you guys have heard me talk about seed oils corn canola sunflower safflower soybean but did you know that grape seed oil though you may think it's healthy is
xTYSwjbsyh0,I want to show you guys how I would construct an animal-based diet I would start by focusing on animal Foods organs like heart and liver and meat every day you might get some bone marrow maybe some eggs I've been eating raw cheese
_5SXYOAuCLc,I want to show you guys my favorite nighttime phone hack you can triple click to get that and triple click to get back in the evening I like to take the blue light off my phone so it's less bright blue
bBBHOpikDaM,the University of Arizona medical school this is where I went to medical school I was not taught to think about the roots of chronic illness I was not taught to think about what causes illness sure
CE6Qaaznvu4,real eggs versus plant-based eggs how can they even call it that think about it what's in a real egg you've got vitamin A you've got choline you've got vitamin K2 you've got fat
PUSb9MyFdiU,I want to tell you guys a hack that I learned from my buddy Andrew huberman shout out to Andrew this is that if you're feeling stressed or you're looking at a computer screen for too long take a break for a couple minutes
Gyi0l-T84ik,eating testicle will likely soon be banned from professional sports check this out if you eat testicle you will be getting bioactive testosterone into your
yH3sfinUSqs,so you guys know that olive oil is better than seed oils but you have to be careful with olive oil this says extra virgin olive oil that means that it
b9v_1Vgb6q0,trying to find the best place to get animal-based food on the go I'm here at McDonald's I've heard they have all beef patties let's see if their burgers are cooked in seed oils come on the burgers
Vw8kgDl3770,the word saturated fat is almost like a bad word it is yeah I think the recent political events really made me more aware of the way that the media can really program us right and I would say
jXTYIPHe28Y,this is how to shop animal based affordably let's go to Walmart get an avocado 68 cents get some apples one dollar and 67 cents a pound it's got
yhYnX1fGNjU,do we know that the diet that we evolved on is the optimal diet for humans I believe the answer to that question is yes what better indicator do we have for what the optimal diet for humans could
K5PryE6TlIo,Oatley oat milk man I gotta call this out look at this guys ingredients oats which is a problem because they have tons of phytic acid second ingredient low arusic acid rapeseed oil what's that
ssqHSKOAWdk,don't think vegetables are great for humans we think about this intuitively high level without getting into the science vegetables canonically are leaves stems roots and seeds of plants now from the
ghVyZtLxjZI,medical students are not taught to think about autoimmunity inflammation all of these conditions in their relation to the foods we eat I'm back at the medical school that I went to the University of
IAputm2gh3g,check this out smart bacon I don't know how they can actually call it bacon and how they can call it smart bacon when it's actually a plant-based food plant-based bacon uh why is it smart to
Zo_Bo696TM8,if you have gut issues and you go to a gastroenterologist like 99 of them will just tell you to go on a proton pump inhibitor which will
5gmNEqaxOEQ,to show you guys the difference between 95.5 ground beef 95 lean five percent fat ground beef and 80 20 which is probably more like 85 15. so this one is
Vm5YFzpdax4,does Chick-fil-A use seed oils on the grilled chicken and the breaded chicken let's go find out can you tell me what oil the chicken is cooked in it says the breaded chicken is cooked in
eRy9eX4Gc3U,just got back from the United States I want to show you guys my fridge in Costa Rica I give you a little mini fridge tour we got some bone broth up here you got some ground beef right there that's most of what I eat I brought some
f2NrDu0_gQA,I'm at Walmart and I'm walking through the cereal aisle I can't help but feel nostalgic a little bit for my childhood I used to eat all of these cereals as a child I used to eat Honey Nut Cheerios I
Nd7JeGdYVME,you've heard of a plant-based diet but this is an animal-based diet I said I have like an animal-based diet you know some people are plant-based I'm animals I love that word yeah animal based yeah
o0Wrri264iw,there's a sign right there that says healthy snacks and right underneath it our Nature Valley sweet and salty nut granola bars which have plenty of corn
G2GRr_-ZYiw,eating red meat will lengthen your life one of the main problems as we age is loss of lean muscle mass also known as sarcopenia having an optimal amount of
5796pyRUxFo,I got some kefir grains I just got them off Amazon they come in a little bag you strain them and then I'm going to show you guys how to make kefir from kefir grains you take the grains you put them
1p7kCX3SJOo,I have a question for the folks at kind bar how exactly are peanuts heart healthy and how can you even write heart healthy
CrUOEf4CQts,maybe you're very Gourmet Gourmet and you like black truffle oil but did you know that the second ingredient is
U3Ec3xY4Hf8,diet soda is damaging your gut please stop drinking this diet soda may be better than regular soda from a weight loss perspective but I don't know how
KQ071pHCyto,here are three animal-based breakfast options that are way better than your sucky oatmeal number one yogurt with fruit raw yogurt is best if you can't find that look for something that is
698-JrKI2js,what do I think about olive oil look it's way better than seed oils this is extra virgin olive oil it's not heated it's not refined it's not bleached it's
U58YWlTgzFE,even at Walmart you can find grass-fed ground beef here's 85 15 organic grass-fed ground beef patty at Walmart it's pretty easy to eat animal base with
DJ9UFz0sZ0A,even in Walmart people know that the impossible Burger is total look it's on sale it's supposed to be 5.96 it's on sale for 256. it's like 55 60
3oICD74K00o,here's how I would shop animal based at Walmart Walmart has organic fruit they got organic apples they've got coconuts at Walmart look at this get some coconut water
yLKulEdvBMU,does cancer research and treatment really get to the root cause of this illness sadly I don't think so the majority of cancer research is aimed at
iQ_bhxIPGEI,when I'm in the U.S I come to gyms and it's always interesting to see U.S gyms I always see tons of people on the cardio machines just endlessly hammering and hammering and hammering and I think
fpDX5D9RnEU,full day of animal-based eating keep in mind I'm very active and I serve two to two and a half hours a day pre-surf 6 a.m two tablespoons of raw honey with a glass of reverse osmosis water after surf I have a big breakfast I have a
9gRbOUIa1ok,red meat is not causing climate change look at these cows they're eating grass they are regenerating the land yes they burp out some methane but the carbon in that methane was part of the
99VYlEXpaoA,doctors don't have time to talk to you most of the time they just give you a pill I'm a doctor and sadly this is what happens when you go to the doctor's
ShEs887Fbsk,check this out guys when you absolutely need a bucket of seed oils you can find a bucket of vegetable oil
aL4lSn6_i2Y,I'm on the run today didn't have time to cook my Burgers so I'm gonna go get some McDonald's let's go how can I help you can I get a grass-fed beef burger an avocado organic banana raw butter on the side
DBDCsDbVKzM,so on the second floor is the Obesity clinic for medicine the UAA Clinic Bariatrics which is obesity medicine and on the first floor you have the snack stand with Reese's Peanut Butter Cups
DOHtXh24ZLk,so I went to medical school not once was nutrition discussed and not once were we challenged as Physicians or physicians in training to think what is the root cause of my patient's issue it's just
tb9rTsZwCAI,the average American eats the equivalent of 40 Years of corn per day in seed oils in 2022 Americans will consume an average of seven tablespoons of seed
HYjT9U6QkEw,is your bone broth actually irritating your gut many people drink bone broth to help heal the gut but unfortunately almost all store-bought bone broth contains things that can damage your
k7xR5DfRXp8,here are four ways to optimize your testosterone naturally number one diet the most important thing you can do is to eat a high quality diet with plenty
a4sK9HJrxW0,I promised you guys a video about how I made kefir two ways that are super simple I start with raw milk that I get from a local producer it's grass-fed then the first way you add kefir milk
afCBg28LP-o,red meat organs fruit these foods do not cause gout gout is the deposition and crystallization of uric acid in the joints of the human body it often
DPtkUk6wQZk,I love butter cheese and milk raw dairy is amazing for you these are all the different types of raw dairy that I eat grass-fed grass-finished raw milk I get
BA_qmBoR6Eg,fruit won't make you fat fruit won't make you diabetic but adding colorful sweet fruits that humans have always sought to your animal-based diet will significantly improve the quality of
XrE5ZkVMaDE,plant-based meat weakens your digestive function and it is less digestible than real meat in a recent study when plant-based meat was given to mice their
2ARPAsZK41c,alcohol is a poison even at low levels it's harming your brain check this out in this study from March of 2022 researchers found a strong association
x3GkeJcPQYc,do you want to lose weight stop eating processed foods don't believe me check out this 2019 study where two groups of people were fed either processed foods
M8NWxug2F_Y,Whole Foods you you can find what I believe is the reason that most people are unhealthy seed oils Sesame peanut almond canola grapeseed oil has a mess
5fsudhrzcWY,that is an upside down pineapple I'm not a swinger they're just better that way because all the juice goes down this is how I cut it open to get rid of this thing
YHOoeh7DqvM,let me tell you guys why I think kale is  look it's a plant leaf it's full of Defense chemicals which chemicals long word isothiocyanates they
dt7sBXy7IVE,I want to show you guys what Med students are eating and being fed at the University of Arizona in Phoenix seed oils seed oils seed oils seed oils
rrOBVnWTduU,this is my homemade kefir it's pretty sour I make it from raw milk and it's fermented fermented foods like kefir have been shown to increase the alpha diversity of the gut plant foods have
FAIuPGlF8zU,[Music] bone marrow is amazing I'm willing to go to Great Lengths to get it as fresh as possible [Music]
BzzuQS8gl3k,don't eat raw egg whites here's why I prefer to eat my egg yolks raw for Taste convenience and preservation of nutrients
l15Jrng7Tmg,raw milk is so much better than pasteurized milk here's why milk is considered raw when it comes directly from the cow without being heated the
Q88y8giVk80,my cholesterol is Sky High am I concerned nope not at all here's why though LDL cholesterol has been widely
wVort7F0Z-M,do you know what's in the cream filling of Oreos it's not dairy or real cream it's two of the most powerful things at making us
l6IhEELwo40,I got some food allergies I'm curious what kind of oil you use to make a stir-fry canola oil okay cool thank you let's get some wet canola and Olive canola olive oil yeah okay the only kind
f0Zw8j7a0KY,let's do a simple experiment with Chia seeds to show you how hard they are for your body to digest I'm going to take some dry chia seeds and mix them with liquid in this case water this
m4-ob_gXY1Y,you guys ask about olives a lot technically olives are a fruit I like them but most of the store-bought olives have garbage ingredients these black
VTmTKw8RXKU,there are way more I think it's five to six times more ex-vegans and vegetarians than there are current vegans and vegetarians wow you hear the same story from the ex-vegans three to five years
yqLuGtlPUQ8,I'm here with my daily supply of bananas to tell you guys why I eat fruit it's simply the best way to get carbohydrates with the least amount of plant toxins
7GomN1xISUs,I'm going to show you how to make the best burger ever let's go I start with eight ounces of grass-fed grass-finished ground beef from a local producer here
MXIT3baMmBo,i find it hilarious that oreos are touted as a vegan food does vegan mean healthy clearly not we know the vegan diets are deficient in all sorts of vitamins and minerals
nNUF6xb6wPM,what if vegetables aren't good for you you've been told the vegetables are the best things to eat what if this isn't true think about it from the perspective of a plant and this will make way more
wd4JnHoI0mo,this looks like a freaking gas station in the cafeteria university of arizona medical school look at this soda what is it 7-eleven all this junk food over here more skittles seed oils
Uinu3EtLd4I,organs are the most nutritious food for humans on the planet and yet almost no one eats them for thousands of generations your hunter-gatherer ancestors have treasured organs like
VuvvYJtVBPY,I used to think Manuka Honey was kind of cool a special honey grown from the new country in New Zealand until I learned that glyphosate is still legal in New Zealand and the twice Japan has
IrokkNTuwF4,there should be a picture of someone getting dialysis from their diabetes on the side of a snickers bar we spoke earlier about canada putting a warning label on their beef we don't even have
1rlHJOy2dJc,why are pharmaceutical commercials even legal the united states and new zealand are the only countries in the world that allow this in 2021 over 5 billion dollars were spent on pharmaceutical
O-0YuRFmiAM,what's healthier sauna or broccoli broccoli contains plant defense chemicals some people believe these plant defense chemicals are a good stressor on the human body
awas0fb9OC0,what's more important diet or exercise obviously both of these are critical to be an optimally healthy human but if i had to prioritize one of these it would
nv29A1cruUg,it's crazy that when most of us think about health food we run from stores like this to restaurants like this mad greens or salad places and we fill up on plant leaves full of isothiocyanates
6utEu2IPLz4,so many children today have diabetes this is the angel wing for children with diabetes at the university of arizona in a pediatric center yes some kids have type 1 diabetes diabetes is type 1 and
puGlv-qjtPY,that bone marrow all that goodness in there all those good fats peptides immune components that support the immune system this is in the center of a femur from a cow this kind of stuff
1xtf1TYfK4s,pharmaceutical companies fund the majority of medical research and studies and what are doctors taught they're taught what's in the medical literature so it's no surprise that the majority of medical education is based around
bCSjz8TVhTY,eating celery is a fantastic way to get sunburned you've been told you should drink tons of celery juice that you should eat celery but did you know that celery is defended just like every other
bUJeEZkDggw,i love cheese especially raw cheeses like parmigiano-reggiano or grano-padano cheese is an incredibly nutritious thing for humans to eat it
5WC3ttkxPvM,we don't live in hunter-gatherer times we don't wear wine class we're not out there hunting but imagine that you do what are you sort of intuitively drawn to in the wild well you're going to hunt animals we know this is true you ask the
dJyfMo9jvZ8,don't trust me don't just take the information that i'm giving you and take it without considering it without questioning it without doing your own research and thinking for yourself
Ed0E5qX9wWg,avocados great i love them avocado oil not a fan at all here's why in 2020 there was a study published on the purity and quality of avocado oils sold
_VxsifaNVAU,look at what I found guys a snack stand in the hospital you got banana chocolates cake iced lemon cake blueberry crumb muffins lemon cranberry muffins
dKTUVGDjKj0,i'm gonna show you guys how to eat animal base for less than ten dollars a day at any grocery store in the united states i've got ground beef sixteen dollars for five pounds that's three dollars and twenty cents a pound i
MjktANQG120,this is how to find raw milk near you i'm in phoenix right now i've never been here i go to real milk.com arizona this farm right here inspire farms
0lVI3v19iUY,how do you detox from seed oils like these corn canola sunflower safflower soybean oils are very high in an omega-6 fatty acid called linoleic acid we know these
WiKQAOWfOi4,how are you gonna get how are you gonna get your choline from eating plants where are you going to get choline from where are you going to get creatine from where are you going to get them plants no there's no creatine in Plants where
MHTwSRP_cjU,being in nature positively affects your brain chemistry if you live in a city or urban environment i challenge you to get into a natural landscape for five to ten minutes a day
FwglS-HbmNw,i don't eat chicken or pork here's why both pigs like the pork that's in this pork sausage and chickens are
YjfM-E-Dr-0,these are the most recent dietary guidelines for americans from the u.s government 2020 to 2025. it's really not surprising that
4WGFtmUcTGg,this is the key to weight loss stop counting calories you've been told that counting calories and portion control with meager nutrient poor things like
lEe-jmO-jt4,coffee is depleting your minerals we know that methylxanthines like caffeine
pttJzgqFBWg,i'm here at a regular grocery store i'm going to show you five things that have processed sugar that are probably in your pantry that you didn't know about processed sugars and seed oils are the single greatest drivers chronic illness
aui30OPBfIA,we have a mental health crisis in this country and it is critical that we understand what is causing this lest we all our families our children continue to suffer i strongly believe that food
NG-Hh3tAkS0,the Whole Foods hot bar is a train wreck almost every single thing here if you read labels expeller pressed canola oil almost every single one of the things in
nMrPJ-VJa1E,vitamin d pills are not enough yes taking a vitamin d supplement can be beneficial if you live in a place that doesn't get a good amount of sunlight for part of the year but what about all the other benefits of
UFueDJUwz2A,throughout 17 years of medical education and practice i learned hundreds if not thousands of pharmaceutical drugs their indications
cve2_kOLN0M,kombucha you guys ask me about this all the time or not i don't drink nearly any store-bought kombucha because i think there's too much sugar in it in order to make kombucha you're adding
YB1DyU0JQY8,why would you ever drink almond milk or give it to your kids these almond milks contain things like carrageenan which damage the gut processed sugars and they contain
fohp3ODi3S8,I don't eat fish here's why sadly most fish is highly contaminated with heavy metals like cadmium Mercury
OIkRZYFbbDQ,you five more things that are probably in your pantry that have seed oils that you didn't know about seed oils are the single greatest driver of chronic illness in the us and the world today
zYcb5nYWtAA,there's a lot of food out there that's basically legal drugs in my opinion and manufacturers are smart there's a lot of money behind these businesses i mean craft whatever the parent company of lays is
r1YX7xzVGdY,eat beef and fruit this is the simplest version of an animal based diet anyone can do this why beef i prefer muscle meat and organs from beef because
OnfrsJx8IAE,one of the saddest things that i see these days is how fat kids are it's terrifying and i think it's completely preventable this is a real tragedy within our
eH7uiHsMgCU,to those of you who would say i could never do that when i recommend cutting out things like coffee or sourdough bread or sugar or seed oils or earbuds
4xRX3Y9BcEc,why do i eat an animal-based diet after 17 years of medical training and practice tons of research experimentation with every diet under the sun to improve my own
PBJN9wDC9IA,this is why i don't eat bacon i know i break your heart when i tell you this but look see all this fat right here pigs are fat animals but like humans
OB-DnC7r6G4,it's tomahawk tuesday how do we celebrate this no seed oils no grains and no alcohol
8V4z6Zjwo18,i'm here at a regular supermarket i'm going to show you five things that are probably in your pantry that have seed oils i believe these are the number one cause of obesity diabetes chronic disease cardiovascular disease in the
c0r7yEixoVI,your breakfast versus my breakfast your breakfast starts with oatmeal oats are a grain grains are seeds seeds are highly defended they are full of plant defense
