Video ID,Transcript
pRNTmVO3ygQ,all right let's talk a little bit about uh the macronutrients I'm consuming while I'm leaning out so normally at sort of Maintenance I'm usually sitting you know roughly 300 grams of protein
8HvEXbTvdx0,hey folks as I am currently been leaning up some people ask me kind of what I'm eating what my macronutrient breakdown looks like so just for review got up to around close to 270 uh on Carnivore I'm
nxoFpFKAbYM,we'll get another common misconception around a carnivore diet is you will become constipated now what is true is most likely if you regret dramatically reduced your fiber intake you go to the
uLEFrKA7oCo,okay here's another mistake I see people on a carnivore diet often doing and this is a very common mistake and one is people do this for the reason of losing weight which is you know Common because there's a lot of people that are
ZdgFUH-o4AI,okay here's one mistake that I see people on a carnivore diet doing quite quite commonly one is is trying to quit coughing when you first transition to a carnivore diet now certainly reducing or
6sNH0kTlwhQ,okay so the question on the other side of the scale but what about protein what's protein you need well you know I mean I think the US RDA is 0.8 grams per kilogram that's abysmally low no one should be that low that's that's that's
iIk4qkYmZ6g,okay if you watch the last video the obvious questions well who are the groups that might benefit from an even higher fat diet well certainly uh what I've seen is people healing certain
jvMw4aoiK1E,okay people are asking to ask me you know about macronutrient Racers on a carnivore diet well I mean for most people you're going to consume probably between 60 and 80 of your calories
9kaoG78e9M4,all right a follow-up question on the dog feeding video and there's one of them there's Maximus and there's Sasha anyway Sasha's about 45 pounds Max was about 18 pounds
ljsAwdzkZos,did you ask me what I feed my dog goes and see if you can see him in front of me anyway the big one is a white Golden Retriever named sausage about 45 pounds
H6e_pvCuj-g,okay let's talk a little bit about all-cause mortality in the uh relationship between ileo cholesterol and likely apob I think there's more studies on LDL suggestions I don't know
VUpFewydSwg,so if we have people that are metabolically healthy is defined by the last video are they likely to have heart disease when their apob levels or LDL levels are
6wJv9qigcMA,okay further discussion on LDL or for that matter APO B now for most people a rise in LDL cholesterol or high level of apob is associated with cardiovascular
BOFHJY89xV4,uh what if I go on a low carb ketogenic or carnivore diet and my LDL cholesterol goes up well first of all first thing I'll tell you is you should not ignore that just because you're on a low carb
32JoLDt78yQ,all right folks I'm getting ready to head out to Jujitsu there's a couple just a couple uh tips I think are helpful in the context of carnivore diet for athletic performance one is stay on top of your
A9Rdr3p863I,all right high fat low fat moderate fat what's the best thing for carnivore well the truth be told is it depends uh you know what I have seen is most people end up eating
C65hjhVe6O8,all right let's talk a little bit about gut issues on Carnivore diet the most common reason I see people still continue to have gut issues on a carnivore diet are primarily uh fat
n7IDgTx3ym4,okay a lot of people consult me with regards to trying to get really lean on a carnivore diet and one of the concepts that I have utilized the so-called concept of fat cycling that is where you
lWF60znL3fk,a lot of people ask me about how much do I need to eat on a carnivore diet well I think if you're starting out the first thing you need to do most people you know have some sort of bad eating habits the first thing is eat enough so you
GQskSm1OpXU,so I am a Bitcoin hodler just just for for reference and the guys that got me you know same thing who wrote a Bitcoin standard and a guy named Mike Goldstein and they are both carnivores and they've been doing it for longer than I I think
zGvTzQYALV8,okay final tip on Cravings you know let's say uh you know the the unfortunately none of these uh techniques work that we talked about in previous videos and you just to come you
2SAKQTbzCCY,all right Cravings let's talk a little bit about those uh first of all um you know there there's a strategy for this that I think works quite well and I call it prevention distraction and then
r2iiAm4TDgQ,okay let's talk about the role of distraction when it comes to Cravings well we know that most Cravings or many Cravings are dependent upon certain hormones the one in particular is
9z2bytr0Zyc,will do a high protein diet or a carnivore diet and they'll notice sometimes that they're serum creatinine number is elevated now in in many cases an elevated serum
KJESZPTBgZI,all right this is a common question that comes up quite often and it is about whether or not you must consume organ Meats to successfully do a carnivore diet well the answer that is generally no there are some people where they
BbId6ZrM218,oh somebody's asking me for a little tip for cooking steak so one thing that I think is an important thing to do is prior to searing a steak always dry it off real well you don't want a lot of
CTZKaU7urUU,hey guys I wanted to share an observation with you that I've seen over the years and one thing I've seen is that Winners tend not to be whiners and whiners tend not to win so the lesson
Est2D8oIr54,Josh and I've been doing this a while and I literally spent every single day of my life talking to people about this stuff and I mean it's almost what happened I seen I mean it's you know mental health gastrointestinal Health osteoarthritis rheumatoid arthritis
HWmnkOcllMA,okay a lot of people ask me about should you eat fish on a carnivore diet Well you certainly can and if you're going to eat fish again if you're on a carnivore diet you're not taking any carbohydrates in or very little uh so you need fat you
Y-CwTfiDnVs,account you should think about as a metabolic disease you know it has a component of metabolic syndrome and often has a component of immunological compromise and so whether or not you eat
G0AHYsKvvoE,all right some people ask me what's it after a car or not and ketogenic diet and which one might I want to choose well there are some similarities both are very low carbohydrate both often have a lot of meat in the diet but you
ycvoDkaKc9s,okay does the carnivore diet help prevent cancer well the the answer to that is we have no idea there's no way to really know that but what I can tell you is that a carnivore diet often helps people lose weight uh so they remove
YYcWJq2HvQw,all right what food should you absolutely avoid so the combination of refined grains sugar and Industrial oils that is what you see most common in most processed foods just get those things
BZNNQe0SeW8,all right let's talk about the top four reasons to eat a carnivore diet well number one it rids us of all Ultra processed foods Ultra processed foods are clearly the cause of most of the
96xl_E8DtuU,all right A lot of people are always asking about the different knives I use to cut up meat so I'll just kind of go through some of this knife here is called an Espada XL and it comes from the company Cold Steel it's quite a nice
PwM_ZyE4VbM,okay let's say you've made the decision to finally get fit you've not exercised most of your life how do you begin well first thing I would say is avoid sedentary Behavior if you're
AnbuHmgyMrg,okay what about feeding your dogs well dogs as you guys may or may not know are uh very heavily carnivorous dogs should be getting meat now uh that meat can
K0ZuawIlu_k,okay fun fact of the day did you know that the number one and number two killer of vegans on Earth are cancer and heart disease just like
dVZiyq1VbtE,all right after seven years of eating a purely carnivorous diet people ask me what what is my favorite cut of steak well time and time again it comes back to the ribeye steak you know it's it's
uRFvq4SSrRE,okay do you have to spend a lot of extra money on the highest quality beef in order to have success on a Carnival diet the answer that is absolutely not people go and buy you know cheap grocery store
HHQMJlkgs0E,all right how much food should I eat on a carnivore diet I know it sounds uh a little goofy but what I will tell you is uh initially particularly those people that are trying to lose weight or are
ZxhwjPtrlC8,all right what up blood pressure and carnivore diet well what usually happens is people's blood pressure normalizes you know high blood pressure often reduces uh it's important uh that you
74lAikKHTac,all right what if you're feeling a little tired sluggish light-headed week when you first started carnivore diet well most of the time that has to do with one of two issues either dehydration so you need up your fluid
Yz7hgDMAuR0,all right what about if you go on a Carnival diet and your serum creatinine level goes up you know that's one of the measures of kind of kidney function well that is something that on a high protein diet is kind of expected you know it's
OP3xSpsKbEU,all right is carnivore diet gonna give me gout the short answer is no it is not now some people eating meat can exacerbate underlying gout now the reason for that is gout is a metabolic
eD3YXBLvYVk,okay my thoughts on adding a stick of butter today sorry my thoughts on adding a stick of butter per day to be honest I'm not really a big fan you know I think a little bit of butter for
vbZkul6EZmM,okay do I eat vegetables answer that is no I don't like vegetables and never did so I don't bother to eat them now it's not to say you can't have vegetables on your particular diet that won't be a
XBF_35x0uCM,hey guys X Sean Baker here let's talk about how to quit sugar well first of all I think the best thing to do is complete abstinence you know get rid of the sugar get rid of all the sugary crap get rid of the artificial sweeteners I
pi7Cnj7PDlg,do you attribute you breaking the world records to to the diet or do you think you cut you could have possibly broken it on a different diet the diet allowed me to do it more than I would have I mean I'm clear I'm definitely convinced
jzhj-djklnQ,so I just started reading about all these people doing this crazy you know I'll meet that and I look back and look back in the days of like uh you know some of the old old-time bodybuilders steak and eggs diets Vince guaran and those types of guys I said well I'm just
uJVA6S83LTc,so I'm 53 now when I when I was about 10 years ago I was 43 I was you know starting to see my health decline I mean I was an athlete my whole life I just want to literally won a
IxF1iwSyLXU,problem is researchers say well that's that's the best we can do because we can't do an ethical study we can't do a you know 20 30 year study just feeding people this and randomizing them you
5otfTXdOSjA,if I was to take all the food in the world and I was going to draw a line in terms of food that would potentially bring down knee pain versus food that would uh inflame or activate more knee
-1xnSr-Qcdk,why did a change in diet have an impact on the knee right and pain and kind of all these aspects I don't think people would connect what you're eating with maybe literally knee pain yeah so the
k0iUeA35GMo,are here are five signs that your doctor is a dummy all right number one if you have a gastroenterologist it tells you your your irritable bowel syndrome or your inflammatory bowel disease has
1I2V9ulQ_hE,most people know the food system is broken and they also know the Health Care system is broken but I think you've really kind of focused on like food may be the solution to two of those problems not just either or how did you become so
IRK3Qp9R7Hc,well let's say on the road and the only place you got is McDonald's can you do stuff can you keep your carnivore stuff on there sure you can so they've got scrambled eggs sausage patties steak Patty folded eggs bacon a sausage egg
kL39_3AS0m4,okay which country do you think has the best beef in this particular list number one Uruguay number two Argentina Brazil Scotland Ireland the USA South Africa Japan Canada Alberta Canada particularly
7UWRNh-Lh50,all right here's some crazy facts about bacon number one bacon is one of the world's oldest cured meat they've been having bacon cured since 1500 Years BC back in China fact number two bacon
1iMgE4k2w1w,okay what are some of the potential negative side effects of statin drugs well one they can certainly lower certain essential nutrients within the body they can decrease sex hormones they
DI4IdP_VkH0,all right guys what do we got in the grill today we got some let's see if we can get in there and see in here in the Ottawa Grill we got a couple uh beef flap steaks these are kind of a steak
KlD76F6dnrg,it's interesting in the United States in the last 30 years we've had a dramatic increase in the Obesity I'm here in the UK I'm glad to see you're not where we are at the United States yet are you still about
SEWL96T7R_U,we're seeing this big push towards plant-based we're ultimately going to see with that is a drive to more and more processed food this is why we see people that go on a whole food plant-based diet they do see some improvement in their health the same
dURUeawtm3w,I spent a year as a vegan I trained for an Iron Man competition as a vegan and I went through the whole thing so I've been there I'd love to get your
_jvk-cLNKK8,you know you mentioned cravings and and going off the rails do you find I guess better willpower I guess for whatever for lack of a better word by changing the way you eat one of the best things
ylDx4c7kMqs,okay we're often asked about how we can do a carnivore diet and not spend a ton of money you know honestly most people say when they do carnivore diet it's actually cheaper or or they're equal to what they normally spend when you get
tMF__twXRds,that a lot of people like to ask about supplement requirements on a carnivore diet honestly I don't think you really need anything quite honestly I the only thing I consume on a regular basis are electrolytes and the reason I do this
M_7S3zpapxw,your big guy big football player guy down but down 100 pounds what do you eat on a database day-to-day basis what does that look like for you I try to lean towards beef just I just I really love beef eat a lot of ground beef
kaG0VrENL48,okay I'm often asked about should I consume grass finish beef or grain finished beef on a carnivore diet well what I will say is that until proven otherwise and I haven't
SrwX3EByGc0,these seven food additives are potentially ruining your health castorium polysorbate 80 silicon dioxide xanthan gum guar gum cellulose and
8zr_aU35Jjs,okay should you have coffee on a carnivore diet well let's listen to some of the pros and cons we're going to start with the pros here so four pros of coffee it can potentially help with exercise performance it can enhance
o61muE4Il54,okay do you necessarily go ketogenic when you're on a carnivore diet well the answer that is no not necessarily you certainly can do a carnivore diet so that will put you in this really heavy ketosis that will be based upon what
58dk72cFxG8,okay Carnival rules for a type 1 diabetic we do see a lot of people having success with type 1 diabetes on a carnivore diet I think one of the important things to realize is very
jdXbq06AYH8,okay should you have coffee on a card over that let's talk about some of the cons okay so coffee beans have lectins which are being problematic for our guts they have phytates which can bind to nutrients preventing their absorption
8kJy2nQxRPA,okay here's six ingredients in Lucky Charms that are trying to kill you number one sugar sugar too much of that stuff try sodium phosphate artificial dyes oats processed starches and fake
oqFFdex-x6c,you want to know seven ways you can improve your poop first of all hydrate move avoid highly processed foods eat the right amount of fats eat enough
ClLX8yyzn-E,let's talk about some interesting facts or some crazy facts about citric acid so citric acid is industrial produces made from black mold black mold feeds on the sugar to create citric acid as a result
4lHidz5wUUY,here are seven major dangers of eating a processed sugar no more increased risk of type 2 diabetes weight gain increased risk of heart disease tooth decay
CNGxWYGoXE8,okay what color is your poop and what does it mean well first of all if it's brown most of the time that's pretty normal green stools could indicate that you are having problems with digestion moving too quickly you're not properly
tlpJgGMzccM,there are five groups of people that potentially need more salt people that are extremely active and sweat a lot people on a low carb diet pregnant women because they have to have expanded levels of circulating fluid to nourish
AjfJlTUv6V4,let's say you are trying to eliminate or limit the sugar that is in your diet let's compare two similar items cheesecake versus cheese and let's compare what they have in them as far as
OBqmcKWzFbg,if you go on a meat-based Elimination Diet a low carb diet you may need to increase your salt intake the reason for this is that when we lower our overall glucose intake we lower our insulin
VVaqZ6SWNjE,there's intermittent fasting damage our metabolism well most likely not intermittent fasting is fasting have been shown to lower insulin levels lower blood sugar increased human growth hormone secretion lowering oxidative
mqYtA_WC9l0,why does salt Keep Us Alive well it manages our blood pressure it helps us to contract our muscles it regulates our fluid keeps our heart pumping and enters our circulation it lowers stress hormones and it regulates the electrical
y2xeuqoLM1c,our seven benefits of intermittent fasting it can potentially help adjust your metabolic rate can lower your blood sugar and insulin levels it can certainly reduce oxidative stress may
kN1zWWaAm80,all right three quick reasons why you might want to avoid grain number one they are loaded with phytates which can leech nutrients from your body their social electins which can lead to damage to your digestive tract and also they
c3FAHHRKqnw,so has some reason why you might want to avoid seed oils for one they can be inflammatory certain studies suggest so can lead to autoimmune flares for many sensitive people can some studies
t73_BOmrBZQ,all right some of you guys may have seen uh vegan deli meat you know one pretending to be uh vegan turkey let's take a look the the claims on the front of the package is healthier for you than
HktoKa-PYy0,all right food attitudes let's talk about ones you might want to consider avoiding so they include things like carrot Gene and DPA BHA artificial colors sodium phosphate potentially
dkPmhMJC04w,did you know there are a number of ingredients that are allowed in American foods which are completely banned in most European nations some of them include things like dyes blue number one and two green three red number three and
59JpGIKweDE,all right for a reason why you may consider avoiding sugar number one sugar can dysregulate your hunger or satiety hormones feeds sugar addiction it can cause insulin and cortisol spikes and it
x8iYz-wqE88,after false scurvy can only be prevented and cured with access to fresh fruits and vegetables and the vitamin C contained therein okay so that is false there is Vitamin C that we can find in
eugE_IK4IMU,or what's something you might be able to do to decrease your chance of heart disease well if it comes to decreasing the amount of reactive or oxidizable oils in the body than replacing oils
lq89M9H_-bI,how do we know if me were about to eat is there's something wrong that we don't want to eat it well you know you can see meat that's been in the fridge for a while like it's had sort of brown coloration to it a lot of times that's fine that's just oxidation that occurs
zrw30zK21q0,well let's say you're at a pizza place and you're in a on a meat-based carnivore low-carb Elimination Diet and you're like what the heck am I going to do there well one thing that many pizza places actually do have obviously meat
7vF0Ly35BS0,let's say you are trying to eliminate or limit the sugar that is in your diet let's compare two similar items cheesecake versus cheese and let's compare what they have in them as far as
OUzPUsw_Zb8,all right let's talk about a couple rules for when you're going out to eat that might help you have success with a Elimination Diet first of all set the foundation meal around protein fat obviously meat is going to be the center
AhsO9pI0JB0,all right let's say you want to go come over and you're worried about where am I going to get my vitamin C from well there are a number of animal-based sources of fresh vitamin C these include oysters shrimp crab Lobster mussels
3QGPkvZf1Bs,our seed oil is damaging your arteries and leading to heart disease well certainly there is some evidence that could lead to oxidative damage there are plant cholesterols such as things like
dASJ78iLJ0Y,true or false a meat-based diet is very complicated to follow and the cooking is very very difficult this is false cutting board a knife a fork and some kind of heating surface all I ever use I
zw5Rns-XtuU,case you don't know what they sneak a lot of sugar into products and they use a bunch of different names they're very sneaky about it so let's learn some of the names for sugar so those include dextrose maltodextrin glucose glucose
GLaG_xBeAZg,now you want to prevent heart attacks avoid diabetes hypertension chronic inflammation a lot of things will cause rapid fluctuations in blood glucose and oxidative stress these things can damage
SXTWk8Q23nw,let's say you are on a animal-based Elimination Diet or meat-based on our carnivore diet you go out to eat you're wondering what the heck can I order on the menu well it's pretty simple there's meat on pretty much every single
YVTGnYWsLiw,let's say you want to get rid of some sugars from your diet to include natural sugars a lot of things you should remove and these things are particularly sweet things like apples pears oranges tangerines clementines grapefruit
TufzpkMCADQ,let's talk about legumes and what legumes you should avoid when being on a meat-based diet interesting in French the word Lagoon means vegetable for some reason I'm not sure why that is but anyway black beans broad beans butter
E0knPzkA8Us,are you made a decision to go on a Elimination Diet you got all this food in the pantry and you're struggling what am I going to do with it if I if I throw it out or give it away am I going to lose all this money well look at it this
5NkXCckG13s,hey folks let's take a look at this this should be fun so let's compare what's more nutritious a whole wheat grain-based bread product or plain old ground beef so let's compare these
rMtCbsAymzE,let's talk a little bit about dining at home versus eating out and some of the major differences there and so when you go out to eat you often will see that a lot of ingredients are added
-jbko3VXbKw,okay folks did you know they they put grain and a lot of stuff and you don't even know it may not realize that it's a company very very good at sneaking grains in there mostly because they're cheap and they can be very problematic
v0MLdro4m4U,all right can you out extra as a bad diet well in part depends on what kind of exercise you're doing how bad your diet is but in general one of the limitations to that as we get more efficient with exercise in general our
n4yM8IjgMo0,probably don't need to be snacking all that much A lot of people particularly people that have metabolic issues either metabolic syndrome pre-diabetes or diabetes snacking can actually be counterproductive it can lead to
UOa5I0__EfM,can you intuitively eat things like Ultra processed food well the short answer is probably not high processed foods mess with your hunger and your fullness hormones in fact they're designed to do that they're designed to
tfQBVcBnfHI,okay true or false all condiments are made with these high processed industrial seed oils well the answer to that is actually false there are some Brands out there where they avoid those things you can find things like mayonnaise that might have something
qcAjdJ9ViAE,let's take a moment to talk a little bit about anti-nutrients that may be found in legumes well certain amines such as histamines and tyramines can certainly act that way lectins oxalates phytites
BBMh_igQ6Qo,all right folks what's the number one thing that people do that are successful on a low carb meat based or carnivore diet the number one thing they do is just have fun with it you know find recipes that you enjoy you know have a
oAngmesFo_c,in a previous video we talked about Foods you might want to look for while you're going out to eat while on a low carb meat based out let's talk about Foods you want to avoid and so first of all there are starchy foods like whole grains rice roast or baked potatoes
_-EV-VMBQZ0,let's talk about vegan vegan jerky versus regular beef jerky and compare some of the ingredients here now I've said before make your own jerky if at
xIkPOEzHNbA,okay true or false almonds are a great source of magnesium well if you look at the nutrition facts on magnesium for almonds it's actually relatively decent but when we actually look at the actual
T2mnlwrhFds,all right what's the number one tip to make sure you always have food you need on hand well it's simple just like you would schedule exercise time like you would schedule brushing your teeth or sleeping schedule a time to shop for the
mLKgYd5OANg,snacks that you might want to utilize on a carnivore style diet there's a whole bunch of you can do so different types of jerkies now ideally if you make your own and I'll share a recipe with how to do that jerkies can be great pork rinds
