Video ID,Transcript
4OcQWhWofoI,they just eat until they're not hungry anymore the problem is a lot of people lose weight on this you know a lot of people get lean on this stuff is that you know your hunger goes down pretty low because you're you know you're eating a lot of fat and a lot of protein
YvQwa2Ci2xA,so there was a nice study that dr peary did in i think 2012 looking at fiber intake and diverticular disease and she did i think it was like 2000 colonoscopies
5p3i0dHIbmo,apparently drinking a can of Coke is just like drinking a glass of orange juice to me an orange juice is just as bad for you as a can of Coke because they both contain 25 grams of sugar whoa
ujjIV3rwIi0,is mayonnaise made with avocado oil healthy these food manufacturers are trying to trick you they say we whisk the finest blend of oils eggs and
LCmUOoBqDV4,can you believe that both of these meals contain 1300 calories but they are not going to make you feel the same after you're done eating them this is half of a large Pizza Hut pizza the crust is made from processed white flour and
nxYyytdZK7A,I just got done with a workout I'm going to give you a tour of my home gym in Costa Rica it's an outdoor gym I got the atg slant block I love this thing for stretching my Cals I got my pull-up bar
EGY8LUSW1rc,this is a breakfast from Starbucks a double chocolate chip Frappuccino and a blueberry muffin and it's full of garbage including 81 gam of processed sugar let me show you guys what that
GshOUKdb9P0,I used to use a Britt water filter to get my water and then I realized they're not really that good at all in fact they're pretty horrible a recent study showed that a Britt water filter only gets out 12 and 14% of lead and arsenic
AH6pYoKBUxs,this is how I shop for butter the first thing I look for is raw butter this grocery store has raw butter that is unheated not pasteurized butter if you can't get raw butter where you are look
B3O_OfrgFWs,come on let me show you guys what's in my fridge Tada got some watermelon juice over here in glass that I Juiced yesterday got some mango puree that I made some local glyphosate free honey
pntOg2TbaM0,what is this pour right on top chicken nuggets dump the whole bed fries Tater to American cheese so some people are
0k7hotNMGVI,did you know that until 1990 McDonald's used to cook their french fries in beef Tallow but since then the french fries have 19 ingredients and they cook them in four different types of seed oils so
Xy5MBeCj-UE,watch this both airpods and wireless headphones emit massive amounts of emfs massive amounts of radio frequency electromagnetic fields that are going straight through your brain and into
qz0pBIa2r7g,one of the things that bugs me the most when I'm traveling is that you can almost always only get water in plastic in airports which is why I realized you can actually bring a coconut on the
YVDoVHlY-7Q,fake Health Foods this one is bad look at this Kashi cereal it's got a heart on the cover it looks like it's healthy it even says it's organic and honey toasted but look at the ingredients and you'll
iM9z2qes7u4,"this cost $23 at Chick-fil-A and this costs $14.50 everything over here is organic both of these meals contain 1,400 calories this is the club chicken"
BX7g_cudbAM,if you're thriving why change anything but if you're not it's really interesting and insightful to question our assumptions about nutrition first assumption meat is horrible for us that's the devil that's the cause of heart disease second assumption
gSb3HwItw3I,Lazy Acres in Los Angeles I just got off a plane and this is my grocery car look at this look at what I got here I got chicken hearts I'm getting some thank you
TugyzhBOUBU,this is how food manufacturers trick you look at this here's a craft Mayo it says it's made with olive oil on the label that sounds healthier than seed oils right but if you look at the ingredients canola oil is the third ingredient
0Hl3nOTIFf0,I was seeing people in Psychiatry and there was never any attention to diet and yeah you're seeing neuroinflammation that's the root cause of most psychiatric illness what's triggering that well it's something coming from here and so dietary changes in
dQrSTdjvbKM,if you have a Wi-Fi router you need to know how much radiation is coming off this thing I'm here with Ryan an electromagnetic engineer we're going to measure how much radiation is coming off my Wi-Fi router why should I care about
OgG4WJqJ1Lc,"both of these meals contain about 1,400 calories this is a large Big Mac meal for McDonald's with one Big Mac large fries and a large Coke 26 g of protein"
nt-25UJ6IaE,this is how I shop for eggs there are tons of different varieties of eggs here how do you even sort through all this so start with Organic you don't want what the chickens are fed to have pesticides on it because those pesticides are going
IuhqZ3d9ex4,in case you guys didn't know about this amazing hack you can bring Coconuts on the airplane so I don't like to drink water in airports you can't get water
X8y8_Ud0CTk,what do you think of this carnivore diet well first of all it's complete nonsense the problem is the saturated fats are very bad for you they clog up your coronary arteries they increase your
FbwG7MXLGYA,I just got in I'm going to show you what I got at the grocery store we got some raw cafir dates oranges pickles and now you guys are going to be excited about that got some maple syrup blueberries
Xh9EMwi5wuU,let me show you guys one of my favorite nighttime phone hacks come here check this out you can set it so you can triple click on the side and have your phone go basically completely orange like that so it takes out all of the
a49gJwAf1yo,120 years ago 130 years ago all Americans ate were animal fats and the rates of cardiovascular disease were a fraction of what they are today so anyone who wants to argue that animal fats are the cause of cardiovascular
s0974tS6ZJ8,the CEO of Kelloggs recently told us that we should be eating cereal for dinner to save money so we're advertising about cereal for dinner if you think about the cost of cereal for a
vQ4BVs3X-bM,bag that I have when I travel so I got some bananas I got some lineage meat sticks the only meat sticks on the planet with
_9ZlUlNMXwA,a study recently published in the New England Journal of Medicine suggests that drinking water out of plastic bottles could significantly increase your risk of a heart attack in this study researchers looked for
rXVe8Vy9cDQ,this is how I shop for nut and plant-based milks I don't even buy them what I do buy is raw milk from real
rTBPV1DkRCA,here's what to eat for breakfast on an animal- based diet orange juice you can have some fruit bananas apples whatever is in seasoned blueberries I also like to have raw milk with honey or cafir with honey eggs preferably pasture
P4c9USv7rV0,I did a vegan diet so I was 7 months of raw vegan about 12 or 13 years ago I lost 25 lbs of muscle I've had autoimmune issues which are resolved now eczema and in connection asthma
MfpXxrRNZ5Y,eating this is like smoking a pack of these a recent study found that the amount of toxic chemicals like acryline and alides in a large fry at McDonald's
FzeRjK7W7rs,greatest athletes in history all loved stake is this their secret to Performance maybe Michael Jordan arguably the greatest basketball player of all time ate steak before every game
FFmN7Cq7m5c,both of these breakfasts contain about 750 calories this is a double chocolate chip Frappuccino from Starbucks and a blueberry muffin combined these contain 81 G of processed sugar that's the
NsldzDNukCg,if you control the food you can control the people we're being told that it's going to destroy the environment to eat natural food in order to change the weather in order to save the environment
es5kIpecHKs,if you use a plastic cutting board you are eating plastic specifically you are eating massive amounts of microplastics small fragments of the plastic cutting board that get into your body and cause
ZYuHFwZbFZg,at a seed oil free restaurant I use this app called seed oil Scout and I found this restaurant in Costa Rica it's pretty rad you can see here on the menu 100% seed oil free they only use buffalo
m1tmB2GAZmI,Americans use over a billion toothbrushes a year apparently every toothbrush that's ever been created since 1930s is still in existence either in the form of a toothbrush that hasn't
vvNN8Hk-msk,[Music] [Laughter] okay this video is amazing this little boy on a farm drinking what appears to
C7UFZofkPuM,this is why you should take your shoes off when you enter your home you might even have mold grown on I definitely have mold you do I'm here with Ryan a building biologist and
VeQkcv8v3gA,look at this guys American Heart Association certified you can buy this label this is about 55% linolic acid and we know that high linolic acids like
HRO1us-xI3E,there is a new study out there that's talking about how eating too much red meat is strongly associated with developing type 2 diabetes what they found is even less than one serving a
dOnDM5NpECs,"both of these meals contain 1,600 calories this cost me $23 this cost me $115.50 but you are going to be much more full for longer with better energy"
mDpL3iHtaw8,even plant-based Burgers know that there's something up with plant-based food you can get Beyond burgers at Sam's Club and I find it hilarious that on this plant-based patties these plant-based Burgers they advertise
H_Y-3hPsVfc,this is the McDonald's play pen this is actually a pretty freaking amazing playground but it's in McDonald's you think that anytime a kid drives by McDonald's in the car with their parents
vqY6QyV_IlI,here are three reasons you should eat more red meat red meat and organs are some of the most nutrient-dense Foods on the planet eating red meat foods like liver and heart will simply improve the
22HuFL6CgnU,if you're buying diapers for your child know what's in them I would look for something that's free from fragrance which is going to be phalates and other xenoestrogen hormone disrupting compounds chlorine bleaches parabens
b3rUWH3-2RU,Marilyn Monroe ate a breakfast of milk with raw eggs every morning and ate liver for dinner Angelina Jolie has said that steak is her beauty secret and that a vegan diet nearly killed her because
AYYIth4Lehc,you ask me what I think about chicken here's the deal chicken is meat it's an animal doesn't contain defense chemicals I think it's much better than eating a ton of plant Foods processed plant Foods or Garbage processed foods but when it
AM5vtp8_be8,I don't drink coffee but if I did here's how I would do it I would start with a good organic coffee I would only brew that coffee with spring water or reverse
tvWdsPxS84c,this is what I use for shampoo and soap come in my shower as you can see there's nothing here I don't use shampoo I don't use soap I just shower in water why do I
W_vKL3_nyTE,seed oils and ice cream that is crazy butter pean ice cream man I used to love this when I was a kid cotton seed oil is the fifth ingredient in there do we even wonder why our kids are getting fat sick
hNjuesC7x7A,it's really clear that there's something going on with these non-nutritive sweeteners I have seen so many cases of people who are trying to lose weight drinking six Diet Cokes a day they're
tZ9tYFDjeig,seed oils in your Healthy sunscreen many of these healthy alternative sunscreens contain seed oils just like you don't want to eat seed oils you do not want to put seed oils on your skin because that
YH2yLu68OIk,I made a meat stick with organs the first of its kind the only meat stick on the planet with liver and heart made entirely with grass-fed grass finished regeneratively raised beef sourc from
TJtY8-5h_pY,men who consume the most cheese have the lowest sperm counts and the worst motility morphology when you eat cheese you're eating something that's three4 fat you're gaining body weight I can reduce your testosterone level just by
Du9aNuJTWyE,Farm ra salmon is colored if you look at the ingredients on farm raay salmon it's going to say salmon and then it's going to say some sort of a colorant farm- raised salmon is anything that says Atlantic salmon but doesn't say wild
Z3zT8KN6dtg,here's my Sprouts grocery haul guys hot take Sprouts crushes Whole Foods way better than Whole Foods look at this I got bison and beef patties from force of nature Venison and beef patties from
WpRIxx5XRd8,this potentially cancer-causing chemical is probably on most of the food in your house right now glyphosate is the most widely used herbicide in the United States today and it is sprayed on so
KMTbFAz3deA,How can there be 10 ingredients in pickles at McDonald's McDonald's pickles contain potassium sorbate a preservative with concerns that it will damage DNA genotoxicity and carcinogenicity that's cancer causing they also contain
kI2XPqhqVHg,this liver contains more nutrients than kale you've been told that kale is a superfood and yeah this is better than an ultra processed food but my money is on liver and red meat when it comes to
batuBQZ8klw,this is a jet lag hack grounding in connection with sunlight to reset the Circadian rhythm grounding in a particular place is connected with the
HWpnTZP4vi4,look at how thin people were in New York City in 1945 this video is striking and incredible I don't really see a single person in this video who is obese and
fUFjScdh6tw,just anecdotally I've had several friends in their 40s and early 50s say they wanted to lose weight and get in shape the thing that's worked every single time and I just say eat meat fish
-i4NDImStFE,vegans still crave meat don't believe me there's a very interesting study that shows that vegans and vegetarians when we put electrodes on their brain at a conscious level they may have an aversion to meat but at a deep seated
_JljWWlVUlU,[Music] [Applause] [Music]
TPT-w__JXWI,I'm here at the farmers market come on so this is raw goats mil from my friend Rodrigo that's the gold half of a plantain tree right here grilled plantain will be amazing this is passion
eu_nLAqwl10,so this is my this is like my favorite thing to do when I'm not surfing and yeah weightlifting this fourth or fifth not even [Music]
TNNoFcJ1OW8,this preeminent director of Avatar and so many movies is investing hundreds of millions of dollars in plant-based protein James Cameron I always think of testosterone is a toxin that you have to
oYYPUlLVNkc,these foods should have a warning Label cigarettes have crazy warning labels look there's a guy there with a respirator and this guy has a tracheostomy it's gnarly we know that cigarettes are harmful for your lungs
7MZvO4CDRS8,I don't use toothpaste I know that causes your brain to go let me show you guys how I do this I use a natural fiber toothbrush so those are bores hair bristles they're not plastic and I just
xittdCv-hvs,there's so much conflicting health information today there's another guy or girl saying Kale's the best thing on the Earth it's a bean diet spinach is amazing and celery juicing right and I'm going to say oh spinach is full of
qjIKsizQK7Q,these type of supplements for M libido crack me up guys what they should have here next to all of these supplements is a freaking steak ground beef liver heart these are the things that are really
5k5w8az8BU8,when I wake in the morning this is the Green Giant which has collagen peptide cinnamon creatine amino acids and I take around 60 pills I'll work out for an hour and then I'll eat this the super
bCZa3pPzv1M,processed foods are making you fat Ultra processed foods at places like McDonald's these foods are highly correlated with obesity here's a chart showing the highest rates of obesity
9inc4BTjYAc,magnesium deficiency can contribute to poor sleep and magnesium deficiency is extremely common with over 56% of the world's population known to be deficient in magnesium how do you get enough
PQWQ_LAE9vU,what is your secret to not freezing you eat steak dang it grassed Humane steak I need to go find some steak
cet7iqK8tZo,this is the biggest secret at Sprouts Farmers Market that you don't know about this is a raw cafir from raw Farm in California I've been to this farm and they can sell this as a pet food it says
rkFASSeIQZ0,this nutrient is critical for heart health and it's nearly impossible to find in plant Foods I'm talking about vitamin K2 and liver is one of the best sources of vitamin K2 on the planet in
KPv79qt1I1c,this is how to get more organs in your diet I got a grassfed grass finish regeneratively raised chuck steak here not good for grilling but really good for ground beef that goes into the grinder then I'm going to add some heart
lqfeDmtppJA,every nutrient that we know of for humans to thrive is in animal Foods is in meat and liver but where are the plant foods that contain vitamin K2 that contain creatine torine anine and
LSY3J49Qpo4,you've got a Pokémon Happy Meal here and you get Pokémon cards with your diabetes obesity depression and bad behavior inducing junk food I ate Happy Meals when I was a kid but let's see what's in here french fries 19 ingredients four
RoifQibJXuY,you are what you eat here are my thoughts for starters directed by a vegan the primary investigator in the study is a vegan who also is the head of the Stanford plant-based initiative which is funded by beyond meat vegan
QaIvsqqaRSo,broccoli is I say this in some of my short form content and I recently just got called out for saying there's not randomized controlled trials in humans to say that broccoli is harmful but here's my take actually don't think you need randomized control trials in
JC32TuPOvrQ,Sprouts now has a grass-fed liver they even say this goodness liver on the back Coline vitamin K2 folate riop flaven this company gets it look at this superfood Powerhouse you only need a
rP1_iwq1rbc,plant-based diet versus animal based diet on a vegan diet you could do this you could do a Whole Foods plant-based diet without the bull without seed oils and high fructose corn syrup but you're
qQYC7go0XUE,550 calories in this muffin half a pound of 8020 ground beef and get the same amount of calories but half a pound of ground beef actually contains real bioavailable nutrients for humans this
HAS-Ht1T36s,this is my meat haul at a specialty butcher in Scottsdale Arizona while I'm traveling I've got a bunch of grass-fed grass finish riye steaks I got some grass-fed ground
AkYqZcZn8PM,vegans they're so right about their intention they want to do well harm less animals do more good in the world that's great I want to do the same thing and I think that they're going about it all the wrong way so if you start with the
RWNdlFKzXQM,I'm in Macy's and I see this cookware and it says PFA free so I do a little research and it turns out this company analon is the subject of a class action lawsuit for falsely advertising that
yeds6sNNitc,I've heard that a lot of these plant-based burger patties stock are crashing I've got some Financial advice for Beyond Burger and impossible Burger Stop investing in Factory produced Ultra
cFwRl-wwiHE,could eating red meat help you live longer a recent study published in the journal science suggests this is a distinct possibility researchers in this study we're looking at a unique amino acid called torine this amino acid
3V9FuHZWhDE,one of the biggest shakeups in the food world over the past 5 or so years is the popularization of plant-based meat and one of the most famous companies doing it is impossible I like the Techno music to the dance club possible Burger
pHtpsR0zdnw,if you listen to mainstream Western medicine they won't even tell you that you can modify your life experience with diet if you get a chronic disease or if you get sick with anything autoimmunity depression anxiety bipolar even
tmOJ2QH1UyI,look at this this bathroom looks really clean and nice but there's a problem here I'm with Ryan an environmental biologist who helped me examine my home and when we looked at my bathroom and
ESvnJWoE0bI,what is where did you gain your background in nutrition oh my God guys I get this this video triggers me so let's see where this goes well because I could become you I could be you as an expert
4om5WTGJQGg,high protein cereals completely fake Health Foods look at the ingredients seed oils sunflower oil and peanut oil and if you read the ingredients carefully it says it contains a bioengineered food ingredient what the
5yLbhlJ6gtY,what's in a Dunkin Donuts Boston cream donut over 70 ingredients in this doughnut you got The Usual Suspects processed sugars corn syrup artificial flavors preservatives sodium benzoate
jGCxzZtqOtM,if you like cheese I've got good news for you I recently came across a randomized control trial in which 10 people were followed for 10 weeks eating 200 gam of cheese a week that's this amount of cheese what the researchers
aVpJ7rjv6A8,here's what I eat for breakfast on an animal- based diet I'm going to start with raw milk that's goats milk and local glyphosate free honey that's one of my favorite things I'll just pour the honey right in there mix it up fresh
yzmqwMSjQh0,plant-based meat releases more carbon dioxide into the atmosphere than real beef in multiple life cycle analyses done on regeneratively raised meat it
Ox_pwVlcZmc,there are 26 packets of sugar in Starbucks holiday drink this is the peppermint mocha and it contains 68 g of sugar there are no micronutrients in
DWMunaOavuY,"shocked at what American High School gym class looked like in the 1960s this footage is from one of the 4,000 us high schools that followed Laser's physical education program that was pushed to be"
5SowFgUc4BI,broccoli is you guys have heard me say it before but I'm going to keep saying it because you need to hear it broccoli is part of the Brasa family of plants this family of plants contains compounds like isoage which prevent the
b51I9ibT7L8,mainstream sunscreens are no good there are multiple studies now about the ingredients in mainstream sunscreens being found in the plasma and that is not a good thing because these are
EzGrZqCLbiU,real steak versus plant-based steak this is a grass-fed grass finished bison ribey regeneratively raised this is a mushroom steak made from mycelium colored with fruit juice and given some
HDTpTKTJceY,could eating red meat help you fight cancer the research is compelling a recent study published in the journal Nature found that when trans vinic acid a fatty acid found exclusively in milk
IhQJA7cJGT8,I'm going to show you the garbage they're serving in the Mayo Clinic cafeteria Western medicine doesn't care about food and the treatment of disease look at this menu Beyond Burger turkey burger hamburgers cheeseburgers all
FjeKpQN8LGE,up until 2013 Pizza Hut was the largest buyer of kale in the United States and what did they use it for they used it for garnish around the outside of the pizza bar up until 2013 nobody gave a
mrESvezjK6c,if you like butter I've got some really good news for you I recently came across a couple of randomized controlled trials in humans showing that consumption of butter is associated with less inflammation check this out the first
U6zVLADBIKI,remove vegetables this is obviously controversial but I think it's important removing leaves and stems and seeds from your diet will improve your health especially seeds now seeds are seeds
U0ACxQ7SC3A,this steak housee is called meat I got my fingers crossed they don't use seed oils for the steak let's go find out are the steaks cooked on any oil on the grill oh we don't use oils cooking steak right we don't use any oil sometimes
wUs0yVAH2d8,James Cameron the director of Avatar and Terminator thinks testosterone is toxic for men I guess it's not surprising that he's made $140 million investment into a
YqKG9GYQ6BA,the first thing I wanted to know was what actually went into the burger me too here what we have in front of me is all of those natural plant ingredients yeah what fat does is it props good
rAHNiFJrrpA,dudes what kind of underwear are you wearing if it's polyester modol elastine spandex containing you are harming your balls my friends listen I care about you
3v4RzI6cDHc,I just made my own ground beef with organs I started with chuck steak cuts not great for steak from a grass-fed grass finish regeneratively raised cow that goes into the grinder then I'm
rTqQN1Yja00,if you take fish oil you need to hear this I think Omega-3s are a valuable part of the human diet but I think there are better ways to get them than fish oils many fish oils including top selling brands contain significant
efqdFG7cvNg,almond milk for 7 years I found out I was lactose intolerant when I was in high school there was a a week where like we just didn't have regular 2% milk in the house and my acne cleared up and that's when I was like oh wait I might be allergic to Dairy right right right
7hpGrnwaMzI,liver is really the original superfood this is the oldest superfood on the planet if we're thinking about superfoods as foods that concentrate bioavailable nutrients that help humans
Cs-TWBmA-w0,this is the best hack that you don't know about for healing your gut I'm here in the walk-in freezer at Raw farm this is basically raw dairy heaven and here you got raw cafir this is raw cultured
2EAyYVkoAP4,had a helmet of cell phones right strap around around my head and around my nuts I would not worry yeah wait what I think he's wrong about this cell phone
CKGqWzOctDI,what even is this it doesn't even move this is the Chick-fil-A sauce the first ingredient soybean oil there's no question in my mind why so many of us are fat sick and unhealthy this is ultra
G5x3aGoLPSg,stay off Tik Tok at night stoping with your circadian rhythm eat actual meat and organs with nutrients that support your brain oh I want to be more clearheaded go to sleep stop with blue light at night stop eating garbage food
