Video ID,Title,Transcript,Combined_Text
74lAikKHTac,Tired and Sluggish on Carnivore Diet?,all right what if you're feeling a little tired sluggish light-headed week when you first started carnivore diet well most of the time that has to do with one of two issues either dehydration so you need up your fluid,Tired and Sluggish on Carnivore Diet? all right what if you're feeling a little tired sluggish light-headed week when you first started carnivore diet well most of the time that has to do with one of two issues either dehydration so you need up your fluid
Yz7hgDMAuR0,Are High Creatinine Levels on the Carnivore Diet Dangerous?,all right what about if you go on a Carnival diet and your serum creatinine level goes up you know that's one of the measures of kind of kidney function well that is something that on a high protein diet is kind of expected you know it's,Are High Creatinine Levels on the Carnivore Diet Dangerous? all right what about if you go on a Carnival diet and your serum creatinine level goes up you know that's one of the measures of kind of kidney function well that is something that on a high protein diet is kind of expected you know it's
OP3xSpsKbEU,Will You Get Gout on the Carnivore Diet?,all right is carnivore diet gonna give me gout the short answer is no it is not now some people eating meat can exacerbate underlying gout now the reason for that is gout is a metabolic,Will You Get Gout on the Carnivore Diet? all right is carnivore diet gonna give me gout the short answer is no it is not now some people eating meat can exacerbate underlying gout now the reason for that is gout is a metabolic
eD3YXBLvYVk,Is Adding Butter to Your Carnivore Diet Beneficial?,okay my thoughts on adding a stick of butter today sorry my thoughts on adding a stick of butter per day to be honest I'm not really a big fan you know I think a little bit of butter for,Is Adding Butter to Your Carnivore Diet Beneficial? okay my thoughts on adding a stick of butter today sorry my thoughts on adding a stick of butter per day to be honest I'm not really a big fan you know I think a little bit of butter for
vbZkul6EZmM,Should You Eat Vegetables on a Carnivore Diet?,okay do I eat vegetables answer that is no I don't like vegetables and never did so I don't bother to eat them now it's not to say you can't have vegetables on your particular diet that won't be a,Should You Eat Vegetables on a Carnivore Diet? okay do I eat vegetables answer that is no I don't like vegetables and never did so I don't bother to eat them now it's not to say you can't have vegetables on your particular diet that won't be a
XBF_35x0uCM,How to Eliminate Sugar from Your Carnivore Diet,hey guys X Sean Baker here let's talk about how to quit sugar well first of all I think the best thing to do is complete abstinence you know get rid of the sugar get rid of all the sugary crap get rid of the artificial sweeteners I,How to Eliminate Sugar from Your Carnivore Diet hey guys X Sean Baker here let's talk about how to quit sugar well first of all I think the best thing to do is complete abstinence you know get rid of the sugar get rid of all the sugary crap get rid of the artificial sweeteners I
pi7Cnj7PDlg,The Carnivore Diet And Breaking World Records,do you attribute you breaking the world records to to the diet or do you think you cut you could have possibly broken it on a different diet the diet allowed me to do it more than I would have I mean I'm clear I'm definitely convinced,The Carnivore Diet And Breaking World Records do you attribute you breaking the world records to to the diet or do you think you cut you could have possibly broken it on a different diet the diet allowed me to do it more than I would have I mean I'm clear I'm definitely convinced
jzhj-djklnQ,My Life-Changing Experience with the Carnivore Diet: The Benefits I Experienced,so I just started reading about all these people doing this crazy you know I'll meet that and I look back and look back in the days of like uh you know some of the old old-time bodybuilders steak and eggs diets Vince guaran and those types of guys I said well I'm just,My Life-Changing Experience with the Carnivore Diet: The Benefits I Experienced so I just started reading about all these people doing this crazy you know I'll meet that and I look back and look back in the days of like uh you know some of the old old-time bodybuilders steak and eggs diets Vince guaran and those types of guys I said well I'm just
uJVA6S83LTc,My Journey to the Carnivore Diet: The Surprising Results I Experienced,so I'm 53 now when I when I was about 10 years ago I was 43 I was you know starting to see my health decline I mean I was an athlete my whole life I just want to literally won a,My Journey to the Carnivore Diet: The Surprising Results I Experienced so I'm 53 now when I when I was about 10 years ago I was 43 I was you know starting to see my health decline I mean I was an athlete my whole life I just want to literally won a
IxF1iwSyLXU,The Problem With Nutritional Science,problem is researchers say well that's that's the best we can do because we can't do an ethical study we can't do a you know 20 30 year study just feeding people this and randomizing them you,The Problem With Nutritional Science problem is researchers say well that's that's the best we can do because we can't do an ethical study we can't do a you know 20 30 year study just feeding people this and randomizing them you
5otfTXdOSjA,How Your Diet Affects Your Overall Health,if I was to take all the food in the world and I was going to draw a line in terms of food that would potentially bring down knee pain versus food that would uh inflame or activate more knee,How Your Diet Affects Your Overall Health if I was to take all the food in the world and I was going to draw a line in terms of food that would potentially bring down knee pain versus food that would uh inflame or activate more knee
-1xnSr-Qcdk,Optimizing Orthopedic Health: The Vital Role of Nutrition,why did a change in diet have an impact on the knee right and pain and kind of all these aspects I don't think people would connect what you're eating with maybe literally knee pain yeah so the,Optimizing Orthopedic Health: The Vital Role of Nutrition why did a change in diet have an impact on the knee right and pain and kind of all these aspects I don't think people would connect what you're eating with maybe literally knee pain yeah so the
k0iUeA35GMo,5 Signs Your Doctor’s a Dummy,are here are five signs that your doctor is a dummy all right number one if you have a gastroenterologist it tells you your your irritable bowel syndrome or your inflammatory bowel disease has,5 Signs Your Doctor’s a Dummy are here are five signs that your doctor is a dummy all right number one if you have a gastroenterologist it tells you your your irritable bowel syndrome or your inflammatory bowel disease has
1I2V9ulQ_hE,How I Achieved Optimal Health and Wellness,most people know the food system is broken and they also know the Health Care system is broken but I think you've really kind of focused on like food may be the solution to two of those problems not just either or how did you become so,How I Achieved Optimal Health and Wellness most people know the food system is broken and they also know the Health Care system is broken but I think you've really kind of focused on like food may be the solution to two of those problems not just either or how did you become so
IRK3Qp9R7Hc,How to Order a Keto/Carnivore Breakfast at McDonald's,well let's say on the road and the only place you got is McDonald's can you do stuff can you keep your carnivore stuff on there sure you can so they've got scrambled eggs sausage patties steak Patty folded eggs bacon a sausage egg,How to Order a Keto/Carnivore Breakfast at McDonald's well let's say on the road and the only place you got is McDonald's can you do stuff can you keep your carnivore stuff on there sure you can so they've got scrambled eggs sausage patties steak Patty folded eggs bacon a sausage egg
kL39_3AS0m4,Which Country Has The Best Beef?,okay which country do you think has the best beef in this particular list number one Uruguay number two Argentina Brazil Scotland Ireland the USA South Africa Japan Canada Alberta Canada particularly,Which Country Has The Best Beef? okay which country do you think has the best beef in this particular list number one Uruguay number two Argentina Brazil Scotland Ireland the USA South Africa Japan Canada Alberta Canada particularly
7UWRNh-Lh50,8 Crazy Facts About Bacon,all right here's some crazy facts about bacon number one bacon is one of the world's oldest cured meat they've been having bacon cured since 1500 Years BC back in China fact number two bacon,8 Crazy Facts About Bacon all right here's some crazy facts about bacon number one bacon is one of the world's oldest cured meat they've been having bacon cured since 1500 Years BC back in China fact number two bacon
1iMgE4k2w1w,7 Ways Statins Can Destroy Your Health,okay what are some of the potential negative side effects of statin drugs well one they can certainly lower certain essential nutrients within the body they can decrease sex hormones they,7 Ways Statins Can Destroy Your Health okay what are some of the potential negative side effects of statin drugs well one they can certainly lower certain essential nutrients within the body they can decrease sex hormones they
DI4IdP_VkH0,What's On The Grill Today?,all right guys what do we got in the grill today we got some let's see if we can get in there and see in here in the Ottawa Grill we got a couple uh beef flap steaks these are kind of a steak,What's On The Grill Today? all right guys what do we got in the grill today we got some let's see if we can get in there and see in here in the Ottawa Grill we got a couple uh beef flap steaks these are kind of a steak
KlD76F6dnrg,The problem with ultra processed foods #carnivorediet,it's interesting in the United States in the last 30 years we've had a dramatic increase in the Obesity I'm here in the UK I'm glad to see you're not where we are at the United States yet are you still about,The problem with ultra processed foods #carnivorediet it's interesting in the United States in the last 30 years we've had a dramatic increase in the Obesity I'm here in the UK I'm glad to see you're not where we are at the United States yet are you still about
SEWL96T7R_U,What does the shift to plant-based really mean for our food and health?,we're seeing this big push towards plant-based we're ultimately going to see with that is a drive to more and more processed food this is why we see people that go on a whole food plant-based diet they do see some improvement in their health the same,What does the shift to plant-based really mean for our food and health? we're seeing this big push towards plant-based we're ultimately going to see with that is a drive to more and more processed food this is why we see people that go on a whole food plant-based diet they do see some improvement in their health the same
dURUeawtm3w,Getting Started on the Carnivore Diet Lifestyle With @LondonRealTV,I spent a year as a vegan I trained for an Iron Man competition as a vegan and I went through the whole thing so I've been there I'd love to get your,Getting Started on the Carnivore Diet Lifestyle With @LondonRealTV I spent a year as a vegan I trained for an Iron Man competition as a vegan and I went through the whole thing so I've been there I'd love to get your
_jvk-cLNKK8,How to Avoid Cravings on a Carnivore Diet!,you know you mentioned cravings and and going off the rails do you find I guess better willpower I guess for whatever for lack of a better word by changing the way you eat one of the best things,How to Avoid Cravings on a Carnivore Diet! you know you mentioned cravings and and going off the rails do you find I guess better willpower I guess for whatever for lack of a better word by changing the way you eat one of the best things
ylDx4c7kMqs,How To Do a Carnivore Diet on a Budget?,okay we're often asked about how we can do a carnivore diet and not spend a ton of money you know honestly most people say when they do carnivore diet it's actually cheaper or or they're equal to what they normally spend when you get,How To Do a Carnivore Diet on a Budget? okay we're often asked about how we can do a carnivore diet and not spend a ton of money you know honestly most people say when they do carnivore diet it's actually cheaper or or they're equal to what they normally spend when you get
tMF__twXRds,What Supplements Should You Take on a Carnivore Diet?,that a lot of people like to ask about supplement requirements on a carnivore diet honestly I don't think you really need anything quite honestly I the only thing I consume on a regular basis are electrolytes and the reason I do this,What Supplements Should You Take on a Carnivore Diet? that a lot of people like to ask about supplement requirements on a carnivore diet honestly I don't think you really need anything quite honestly I the only thing I consume on a regular basis are electrolytes and the reason I do this
M_7S3zpapxw,Matt's Carnivore Diet Success Story,your big guy big football player guy down but down 100 pounds what do you eat on a database day-to-day basis what does that look like for you I try to lean towards beef just I just I really love beef eat a lot of ground beef,Matt's Carnivore Diet Success Story your big guy big football player guy down but down 100 pounds what do you eat on a database day-to-day basis what does that look like for you I try to lean towards beef just I just I really love beef eat a lot of ground beef
kaG0VrENL48,Grass Fed or Grain Fed Beef?,okay I'm often asked about should I consume grass finish beef or grain finished beef on a carnivore diet well what I will say is that until proven otherwise and I haven't,Grass Fed or Grain Fed Beef? okay I'm often asked about should I consume grass finish beef or grain finished beef on a carnivore diet well what I will say is that until proven otherwise and I haven't
SrwX3EByGc0,These 7 Food Additives Are Wrecking Your Health!,these seven food additives are potentially ruining your health castorium polysorbate 80 silicon dioxide xanthan gum guar gum cellulose and,These 7 Food Additives Are Wrecking Your Health! these seven food additives are potentially ruining your health castorium polysorbate 80 silicon dioxide xanthan gum guar gum cellulose and
8zr_aU35Jjs,The Benefits of Coffee,okay should you have coffee on a carnivore diet well let's listen to some of the pros and cons we're going to start with the pros here so four pros of coffee it can potentially help with exercise performance it can enhance,The Benefits of Coffee okay should you have coffee on a carnivore diet well let's listen to some of the pros and cons we're going to start with the pros here so four pros of coffee it can potentially help with exercise performance it can enhance
o61muE4Il54,Do You Go Ketogenic When On a Carnivore Diet?,okay do you necessarily go ketogenic when you're on a carnivore diet well the answer that is no not necessarily you certainly can do a carnivore diet so that will put you in this really heavy ketosis that will be based upon what,Do You Go Ketogenic When On a Carnivore Diet? okay do you necessarily go ketogenic when you're on a carnivore diet well the answer that is no not necessarily you certainly can do a carnivore diet so that will put you in this really heavy ketosis that will be based upon what
58dk72cFxG8,Carnivore Rules for a Type 1 Diabetic,okay Carnival rules for a type 1 diabetic we do see a lot of people having success with type 1 diabetes on a carnivore diet I think one of the important things to realize is very,Carnivore Rules for a Type 1 Diabetic okay Carnival rules for a type 1 diabetic we do see a lot of people having success with type 1 diabetes on a carnivore diet I think one of the important things to realize is very
jdXbq06AYH8,5 Cons of Coffee: What You Need to Know,okay should you have coffee on a card over that let's talk about some of the cons okay so coffee beans have lectins which are being problematic for our guts they have phytates which can bind to nutrients preventing their absorption,5 Cons of Coffee: What You Need to Know okay should you have coffee on a card over that let's talk about some of the cons okay so coffee beans have lectins which are being problematic for our guts they have phytates which can bind to nutrients preventing their absorption
8kJy2nQxRPA,6 Reasons to Avoid Lucky Charms,okay here's six ingredients in Lucky Charms that are trying to kill you number one sugar sugar too much of that stuff try sodium phosphate artificial dyes oats processed starches and fake,6 Reasons to Avoid Lucky Charms okay here's six ingredients in Lucky Charms that are trying to kill you number one sugar sugar too much of that stuff try sodium phosphate artificial dyes oats processed starches and fake
oqFFdex-x6c,7 Ways to Improve Your Poop!,you want to know seven ways you can improve your poop first of all hydrate move avoid highly processed foods eat the right amount of fats eat enough,7 Ways to Improve Your Poop! you want to know seven ways you can improve your poop first of all hydrate move avoid highly processed foods eat the right amount of fats eat enough
ClLX8yyzn-E,Crazy Facts about Citric Acid!,let's talk about some interesting facts or some crazy facts about citric acid so citric acid is industrial produces made from black mold black mold feeds on the sugar to create citric acid as a result,Crazy Facts about Citric Acid! let's talk about some interesting facts or some crazy facts about citric acid so citric acid is industrial produces made from black mold black mold feeds on the sugar to create citric acid as a result
4lHidz5wUUY,7 Dangers of Eating Processed Sugar,here are seven major dangers of eating a processed sugar no more increased risk of type 2 diabetes weight gain increased risk of heart disease tooth decay,7 Dangers of Eating Processed Sugar here are seven major dangers of eating a processed sugar no more increased risk of type 2 diabetes weight gain increased risk of heart disease tooth decay
CNGxWYGoXE8,What Does The Color of Your Poop Mean?,okay what color is your poop and what does it mean well first of all if it's brown most of the time that's pretty normal green stools could indicate that you are having problems with digestion moving too quickly you're not properly,What Does The Color of Your Poop Mean? okay what color is your poop and what does it mean well first of all if it's brown most of the time that's pretty normal green stools could indicate that you are having problems with digestion moving too quickly you're not properly
tlpJgGMzccM,Do You Need More Salt In Your Diet?,there are five groups of people that potentially need more salt people that are extremely active and sweat a lot people on a low carb diet pregnant women because they have to have expanded levels of circulating fluid to nourish,Do You Need More Salt In Your Diet? there are five groups of people that potentially need more salt people that are extremely active and sweat a lot people on a low carb diet pregnant women because they have to have expanded levels of circulating fluid to nourish
AjfJlTUv6V4,How Intermittent Fasting Builds Muscle!,let's say you are trying to eliminate or limit the sugar that is in your diet let's compare two similar items cheesecake versus cheese and let's compare what they have in them as far as,How Intermittent Fasting Builds Muscle! let's say you are trying to eliminate or limit the sugar that is in your diet let's compare two similar items cheesecake versus cheese and let's compare what they have in them as far as
OBqmcKWzFbg,Transitioning to a Meat-Based Diet? Eat More of THIS!,if you go on a meat-based Elimination Diet a low carb diet you may need to increase your salt intake the reason for this is that when we lower our overall glucose intake we lower our insulin,Transitioning to a Meat-Based Diet? Eat More of THIS! if you go on a meat-based Elimination Diet a low carb diet you may need to increase your salt intake the reason for this is that when we lower our overall glucose intake we lower our insulin
VVaqZ6SWNjE,Can Intermittent Fasting Damage Your Metabolism?,there's intermittent fasting damage our metabolism well most likely not intermittent fasting is fasting have been shown to lower insulin levels lower blood sugar increased human growth hormone secretion lowering oxidative,Can Intermittent Fasting Damage Your Metabolism? there's intermittent fasting damage our metabolism well most likely not intermittent fasting is fasting have been shown to lower insulin levels lower blood sugar increased human growth hormone secretion lowering oxidative
mqYtA_WC9l0,The 5 Ways Salt Keeps You Alive!,why does salt Keep Us Alive well it manages our blood pressure it helps us to contract our muscles it regulates our fluid keeps our heart pumping and enters our circulation it lowers stress hormones and it regulates the electrical,The 5 Ways Salt Keeps You Alive! why does salt Keep Us Alive well it manages our blood pressure it helps us to contract our muscles it regulates our fluid keeps our heart pumping and enters our circulation it lowers stress hormones and it regulates the electrical
y2xeuqoLM1c,7 Powerful Benefits of Intermittent Fasting,our seven benefits of intermittent fasting it can potentially help adjust your metabolic rate can lower your blood sugar and insulin levels it can certainly reduce oxidative stress may,7 Powerful Benefits of Intermittent Fasting our seven benefits of intermittent fasting it can potentially help adjust your metabolic rate can lower your blood sugar and insulin levels it can certainly reduce oxidative stress may
kN1zWWaAm80,3 Reasons to AVOID Grains,all right three quick reasons why you might want to avoid grain number one they are loaded with phytates which can leech nutrients from your body their social electins which can lead to damage to your digestive tract and also they,3 Reasons to AVOID Grains all right three quick reasons why you might want to avoid grain number one they are loaded with phytates which can leech nutrients from your body their social electins which can lead to damage to your digestive tract and also they
c3FAHHRKqnw,The Hidden Dangers of Seed Oils: Why You Should AVOID Them!,so has some reason why you might want to avoid seed oils for one they can be inflammatory certain studies suggest so can lead to autoimmune flares for many sensitive people can some studies,The Hidden Dangers of Seed Oils: Why You Should AVOID Them! so has some reason why you might want to avoid seed oils for one they can be inflammatory certain studies suggest so can lead to autoimmune flares for many sensitive people can some studies
t73_BOmrBZQ,Vegan vs. Real Deli Meat: An In-Depth Ingredient Comparison,all right some of you guys may have seen uh vegan deli meat you know one pretending to be uh vegan turkey let's take a look the the claims on the front of the package is healthier for you than,Vegan vs. Real Deli Meat: An In-Depth Ingredient Comparison all right some of you guys may have seen uh vegan deli meat you know one pretending to be uh vegan turkey let's take a look the the claims on the front of the package is healthier for you than
HktoKa-PYy0,Top Food Additives You Should AVOID for Better Health!,all right food attitudes let's talk about ones you might want to consider avoiding so they include things like carrot Gene and DPA BHA artificial colors sodium phosphate potentially,Top Food Additives You Should AVOID for Better Health! all right food attitudes let's talk about ones you might want to consider avoiding so they include things like carrot Gene and DPA BHA artificial colors sodium phosphate potentially
dkPmhMJC04w,These TOXIC Ingredients Are Banned in Europe (LOOK OUT FOR THEM),did you know there are a number of ingredients that are allowed in American foods which are completely banned in most European nations some of them include things like dyes blue number one and two green three red number three and,These TOXIC Ingredients Are Banned in Europe (LOOK OUT FOR THEM) did you know there are a number of ingredients that are allowed in American foods which are completely banned in most European nations some of them include things like dyes blue number one and two green three red number three and
59JpGIKweDE,The Case Against Sugar: 4 Reasons to Quit,all right for a reason why you may consider avoiding sugar number one sugar can dysregulate your hunger or satiety hormones feeds sugar addiction it can cause insulin and cortisol spikes and it,The Case Against Sugar: 4 Reasons to Quit all right for a reason why you may consider avoiding sugar number one sugar can dysregulate your hunger or satiety hormones feeds sugar addiction it can cause insulin and cortisol spikes and it
x8iYz-wqE88,True or False: Scurvy Can Only Be Cured By the Vitamin C in Fruits and Vegetables,after false scurvy can only be prevented and cured with access to fresh fruits and vegetables and the vitamin C contained therein okay so that is false there is Vitamin C that we can find in,True or False: Scurvy Can Only Be Cured By the Vitamin C in Fruits and Vegetables after false scurvy can only be prevented and cured with access to fresh fruits and vegetables and the vitamin C contained therein okay so that is false there is Vitamin C that we can find in
