Video ID,Title,Transcript,Combined_Text
HDTpTKTJceY,New study shows red meat protects from cancer,could eating red meat help you fight cancer the research is compelling a recent study published in the journal Nature found that when trans vinic acid a fatty acid found exclusively in milk,New study shows red meat protects from cancer could eating red meat help you fight cancer the research is compelling a recent study published in the journal Nature found that when trans vinic acid a fatty acid found exclusively in milk
IhQJA7cJGT8,Hospitals are serving junk food?,I'm going to show you the garbage they're serving in the Mayo Clinic cafeteria Western medicine doesn't care about food and the treatment of disease look at this menu Beyond Burger turkey burger hamburgers cheeseburgers all,Hospitals are serving junk food? I'm going to show you the garbage they're serving in the Mayo Clinic cafeteria Western medicine doesn't care about food and the treatment of disease look at this menu Beyond Burger turkey burger hamburgers cheeseburgers all
FjeKpQN8LGE,You have been lied to about kale,up until 2013 Pizza Hut was the largest buyer of kale in the United States and what did they use it for they used it for garnish around the outside of the pizza bar up until 2013 nobody gave a,You have been lied to about kale up until 2013 Pizza Hut was the largest buyer of kale in the United States and what did they use it for they used it for garnish around the outside of the pizza bar up until 2013 nobody gave a
mrESvezjK6c,This study shows the benefits of eating butter,if you like butter I've got some really good news for you I recently came across a couple of randomized controlled trials in humans showing that consumption of butter is associated with less inflammation check this out the first,This study shows the benefits of eating butter if you like butter I've got some really good news for you I recently came across a couple of randomized controlled trials in humans showing that consumption of butter is associated with less inflammation check this out the first
U6zVLADBIKI,Vegetables may be harmful…,remove vegetables this is obviously controversial but I think it's important removing leaves and stems and seeds from your diet will improve your health especially seeds now seeds are seeds,Vegetables may be harmful… remove vegetables this is obviously controversial but I think it's important removing leaves and stems and seeds from your diet will improve your health especially seeds now seeds are seeds
U0ACxQ7SC3A,Is beef tallow the best cooking fat?,this steak housee is called meat I got my fingers crossed they don't use seed oils for the steak let's go find out are the steaks cooked on any oil on the grill oh we don't use oils cooking steak right we don't use any oil sometimes,Is beef tallow the best cooking fat? this steak housee is called meat I got my fingers crossed they don't use seed oils for the steak let's go find out are the steaks cooked on any oil on the grill oh we don't use oils cooking steak right we don't use any oil sometimes
wUs0yVAH2d8,Is pea protein good for testosterone?,James Cameron the director of Avatar and Terminator thinks testosterone is toxic for men I guess it's not surprising that he's made $140 million investment into a,Is pea protein good for testosterone? James Cameron the director of Avatar and Terminator thinks testosterone is toxic for men I guess it's not surprising that he's made $140 million investment into a
YqKG9GYQ6BA,What’s ACTUALLY inside Impossible Burger??,the first thing I wanted to know was what actually went into the burger me too here what we have in front of me is all of those natural plant ingredients yeah what fat does is it props good,What’s ACTUALLY inside Impossible Burger?? the first thing I wanted to know was what actually went into the burger me too here what we have in front of me is all of those natural plant ingredients yeah what fat does is it props good
rAHNiFJrrpA,Underwear lower testosterone?,dudes what kind of underwear are you wearing if it's polyester modol elastine spandex containing you are harming your balls my friends listen I care about you,Underwear lower testosterone? dudes what kind of underwear are you wearing if it's polyester modol elastine spandex containing you are harming your balls my friends listen I care about you
3v4RzI6cDHc,Homemade ground beef with organs #animalbased,I just made my own ground beef with organs I started with chuck steak cuts not great for steak from a grass-fed grass finish regeneratively raised cow that goes into the grinder then I'm,Homemade ground beef with organs #animalbased I just made my own ground beef with organs I started with chuck steak cuts not great for steak from a grass-fed grass finish regeneratively raised cow that goes into the grinder then I'm
rTqQN1Yja00,Are you taking fish oil? Beware of this…,if you take fish oil you need to hear this I think Omega-3s are a valuable part of the human diet but I think there are better ways to get them than fish oils many fish oils including top selling brands contain significant,Are you taking fish oil? Beware of this… if you take fish oil you need to hear this I think Omega-3s are a valuable part of the human diet but I think there are better ways to get them than fish oils many fish oils including top selling brands contain significant
efqdFG7cvNg,How to reverse lactose intolerance,almond milk for 7 years I found out I was lactose intolerant when I was in high school there was a a week where like we just didn't have regular 2% milk in the house and my acne cleared up and that's when I was like oh wait I might be allergic to Dairy right right right,How to reverse lactose intolerance almond milk for 7 years I found out I was lactose intolerant when I was in high school there was a a week where like we just didn't have regular 2% milk in the house and my acne cleared up and that's when I was like oh wait I might be allergic to Dairy right right right
7hpGrnwaMzI,This is the world’s OLDEST SUPERFOOD #animalbased,liver is really the original superfood this is the oldest superfood on the planet if we're thinking about superfoods as foods that concentrate bioavailable nutrients that help humans,This is the world’s OLDEST SUPERFOOD #animalbased liver is really the original superfood this is the oldest superfood on the planet if we're thinking about superfoods as foods that concentrate bioavailable nutrients that help humans
Cs-TWBmA-w0,How to fix your gut: best diet hack,this is the best hack that you don't know about for healing your gut I'm here in the walk-in freezer at Raw farm this is basically raw dairy heaven and here you got raw cafir this is raw cultured,How to fix your gut: best diet hack this is the best hack that you don't know about for healing your gut I'm here in the walk-in freezer at Raw farm this is basically raw dairy heaven and here you got raw cafir this is raw cultured
2EAyYVkoAP4,Is Elon Musk wrong about THIS?? 😳,had a helmet of cell phones right strap around around my head and around my nuts I would not worry yeah wait what I think he's wrong about this cell phone,Is Elon Musk wrong about THIS?? 😳 had a helmet of cell phones right strap around around my head and around my nuts I would not worry yeah wait what I think he's wrong about this cell phone
CKGqWzOctDI,What’s inside Chick-fil-A sauce?,what even is this it doesn't even move this is the Chick-fil-A sauce the first ingredient soybean oil there's no question in my mind why so many of us are fat sick and unhealthy this is ultra,What’s inside Chick-fil-A sauce? what even is this it doesn't even move this is the Chick-fil-A sauce the first ingredient soybean oil there's no question in my mind why so many of us are fat sick and unhealthy this is ultra
G5x3aGoLPSg,How to fix the root cause of your problems #animalbased,stay off Tik Tok at night stoping with your circadian rhythm eat actual meat and organs with nutrients that support your brain oh I want to be more clearheaded go to sleep stop with blue light at night stop eating garbage food,How to fix the root cause of your problems #animalbased stay off Tik Tok at night stoping with your circadian rhythm eat actual meat and organs with nutrients that support your brain oh I want to be more clearheaded go to sleep stop with blue light at night stop eating garbage food
7JK29_zS4s4,How to shop for ORANGE JUICE,when you're looking for orange juice at the grocery store here's what to look for I look for a cold pressed juice that is organic and preferably not pasteurized so Evolution cold pressed organic orange juice you can see on the,How to shop for ORANGE JUICE when you're looking for orange juice at the grocery store here's what to look for I look for a cold pressed juice that is organic and preferably not pasteurized so Evolution cold pressed organic orange juice you can see on the
C1tSF6dy4uk,What’s the BEST health food? #animalbased,this is my favorite Health it's not this red meat steaks organs you simply can't get the nutrients found in red meat in plant Foods you can't get it you've been,What’s the BEST health food? #animalbased this is my favorite Health it's not this red meat steaks organs you simply can't get the nutrients found in red meat in plant Foods you can't get it you've been
2orOO645Znk,Reacting to soy TROLL,Paul where is the research showing soy consumption has feminizing effects in men soy does not have any feminizing effects in men if soy is feminizing then,Reacting to soy TROLL Paul where is the research showing soy consumption has feminizing effects in men soy does not have any feminizing effects in men if soy is feminizing then
1atXdqKNd50,NEVER give baby formulas to your children - here is WHY,the number one selling brand of infant formula in the country is full of seed oils look at this safflower oil and soybean oil these are some of the worst,NEVER give baby formulas to your children - here is WHY the number one selling brand of infant formula in the country is full of seed oils look at this safflower oil and soybean oil these are some of the worst
8I-GpwFe5Fg,The most powerful motivator #animalbased,Thanksgiving is about being grateful and today I'm grateful for you guys for you because it's your stories it's the messages you send me that's what keeps me going I'm so grateful to get to do,The most powerful motivator #animalbased Thanksgiving is about being grateful and today I'm grateful for you guys for you because it's your stories it's the messages you send me that's what keeps me going I'm so grateful to get to do
spZ6hsjuKnY,Nighttime routine for optimal sleep,this is my nighttime routine it starts with me watching the sunset outside with bare feet connected to the ground then I eat some dinner usually try to finish dinner a few hours before I'm going to,Nighttime routine for optimal sleep this is my nighttime routine it starts with me watching the sunset outside with bare feet connected to the ground then I eat some dinner usually try to finish dinner a few hours before I'm going to
ZnS8VH8K-oY,THIS is in WHEATIES cereal?? 😳😳,there are essentially construction dust iron filings added to weedies you could use a magnet to pull out the iron filings in weedies and other cereals and I did it I took this box of weedies I,THIS is in WHEATIES cereal?? 😳😳 there are essentially construction dust iron filings added to weedies you could use a magnet to pull out the iron filings in weedies and other cereals and I did it I took this box of weedies I
sHHYWArS5Us,What’s inside a McDonald’s chicken nugget?,your McDonald's chicken nuggets contain 30 ingredients I used to love these as a kid too I ate too many of them now that I know what's in them it's kind of scary I think part of the reason that I was kind of a fat kid is because my parents,What’s inside a McDonald’s chicken nugget? your McDonald's chicken nuggets contain 30 ingredients I used to love these as a kid too I ate too many of them now that I know what's in them it's kind of scary I think part of the reason that I was kind of a fat kid is because my parents
H3B8UVdlaQQ,How to order at restaurants: #1 thing you should ask #animalbased,this is how I order at restaurants you can look at a menu at a steakhouse most of the steaks if you ask them are not cooked in seed ears I'm going to ask the waiter if they're cooking in seed oils but I don't think they are oysters are,How to order at restaurants: #1 thing you should ask #animalbased this is how I order at restaurants you can look at a menu at a steakhouse most of the steaks if you ask them are not cooked in seed ears I'm going to ask the waiter if they're cooking in seed oils but I don't think they are oysters are
brzQVOWPjfQ,What are the BEST foods for PREGNANCY? #animalbased,I ate a lot of meat a lot of bone broth a lot of organs I had such great pregnancies I think that was a big part of it I don't doubt it I mean this is so evolutionarily consistent if you go to cultures around the world this is what,What are the BEST foods for PREGNANCY? #animalbased I ate a lot of meat a lot of bone broth a lot of organs I had such great pregnancies I think that was a big part of it I don't doubt it I mean this is so evolutionarily consistent if you go to cultures around the world this is what
-TqUmZjq_fA,Eat these foods to improve gut health,here's why you should eat more fermented foods look I'm a fan of these you got pickles in here you've got sauerkraut down here with just cabbage water and salt in there you've got cfir here these,Eat these foods to improve gut health here's why you should eat more fermented foods look I'm a fan of these you got pickles in here you've got sauerkraut down here with just cabbage water and salt in there you've got cfir here these
mXBW98oWfcA,How raw kefir is made - gut healing food #animalbased,there are 800 gallons of truly raw milk fermenting in this stainless steel vat to make raw cafir it's one of my favorite foods on the planet raw dairy,How raw kefir is made - gut healing food #animalbased there are 800 gallons of truly raw milk fermenting in this stainless steel vat to make raw cafir it's one of my favorite foods on the planet raw dairy
qxjfTWRLyHk,Is farm raised salmon healthy?,this farm raay salmon is actually this color but they add color to it to make it look like wild salmon which it is nothing like farm rais salmon is raised,Is farm raised salmon healthy? this farm raay salmon is actually this color but they add color to it to make it look like wild salmon which it is nothing like farm rais salmon is raised
psjDahfNkXs,Plant based meat vs real meat: which is healthier?,this is how plant-based ground beef is made you take some soy protein concentrate sunflower oil soy leg hemoglobin then you add some methyl,Plant based meat vs real meat: which is healthier? this is how plant-based ground beef is made you take some soy protein concentrate sunflower oil soy leg hemoglobin then you add some methyl
fxgw7hYAuzk,Plant-based LIES told by NYC Mayor,the vast major majority of food contributing to our emission crisis lies in meat and dairy products we already know that a plant plant power diet is,Plant-based LIES told by NYC Mayor the vast major majority of food contributing to our emission crisis lies in meat and dairy products we already know that a plant plant power diet is
dj89t8gj5rw,Subway lied to me…,is the beef at Subway real beef are the meatballs pure meat let's go find out the meatball marinara are those meatballs like all those are pure meat is there anything in them except I think so yeah Subway is a restaurant that,Subway lied to me… is the beef at Subway real beef are the meatballs pure meat let's go find out the meatball marinara are those meatballs like all those are pure meat is there anything in them except I think so yeah Subway is a restaurant that
EqZwsk-ewaw,Why Western medicine is failing…,so I went to medical school not once was nutrition discussed and not once were we challenged as Physicians or physicians in training to think what is the root cause of my patient issue it's just and,Why Western medicine is failing… so I went to medical school not once was nutrition discussed and not once were we challenged as Physicians or physicians in training to think what is the root cause of my patient issue it's just and
7MqjC_jK_3Q,Eat this to increase testosterone and improve insulin sensitivity #health,honey is a health food I love having local raw honey in my life and my diet so much that I got my own little Hive I used to think honey was just sugar but,Eat this to increase testosterone and improve insulin sensitivity #health honey is a health food I love having local raw honey in my life and my diet so much that I got my own little Hive I used to think honey was just sugar but
i9lk6qwHfQs,How to open a coconut in Costa Rica 🥥🌴,this is how you open a young coconut in Costa Rica first way super simple there are three little eyes on top the biggest eye is soft you can take a metal straw push it right in there and you've got a,How to open a coconut in Costa Rica 🥥🌴 this is how you open a young coconut in Costa Rica first way super simple there are three little eyes on top the biggest eye is soft you can take a metal straw push it right in there and you've got a
ln0dMwo7NbM,The best temperature to cook a steak,this is why you should eat your steak medium rare there are many nutrients in steak but some of these are actually denatured by heat especially things like torine and some of your other B vitamins,The best temperature to cook a steak this is why you should eat your steak medium rare there are many nutrients in steak but some of these are actually denatured by heat especially things like torine and some of your other B vitamins
kjVia978VyQ,How to detox from fluoride in tap water and toothpaste,look at this you guys it looks like a piece of coyote poo or something but it's a Tamarind it's a fruit that grows in Costa R Thailand other places in the,How to detox from fluoride in tap water and toothpaste look at this you guys it looks like a piece of coyote poo or something but it's a Tamarind it's a fruit that grows in Costa R Thailand other places in the
p5P7zfyyzno,The psychology behind Skittles,here's the Twisted truth about Skittles do you have any idea why manufacturers want to make candies and all sorts of different colors like this it's very appealing to our eyes isn't it cuz,The psychology behind Skittles here's the Twisted truth about Skittles do you have any idea why manufacturers want to make candies and all sorts of different colors like this it's very appealing to our eyes isn't it cuz
Bf2pzWcyy5U,Chick-fil-A’s FAKE chicken sandwich?,over 100 ingredients in here you are led to believe this is 100% chicken I even asked them is your grilled chicken sandwich is that 100% chicken it would be real big,Chick-fil-A’s FAKE chicken sandwich? over 100 ingredients in here you are led to believe this is 100% chicken I even asked them is your grilled chicken sandwich is that 100% chicken it would be real big
nyo3x-z0Hfg,Corruption in the food industry,there's a lot of food out there that's basically legal drugs in my opinion and manufacturers are smart there's a lot of money behind these businesses craft whatever the parent company of lazes nestle these aggr business multinational,Corruption in the food industry there's a lot of food out there that's basically legal drugs in my opinion and manufacturers are smart there's a lot of money behind these businesses craft whatever the parent company of lazes nestle these aggr business multinational
S-MdRuRaC4s,My Morning Routine #animalbased,this is my morning routine after waking up with the sun I head to the bathroom to take care of business got to love a good poop then I turned the Wi-Fi back on because I had it turned off overnight,My Morning Routine #animalbased this is my morning routine after waking up with the sun I head to the bathroom to take care of business got to love a good poop then I turned the Wi-Fi back on because I had it turned off overnight
kY67wF0FXpk,Muscle cramps? Don’t make this mistake #animalbased,if you have muscle cramps you need to listen to this getting minerals from your food magnesium potassium and calcium is essential for avoiding muscle cramps but a lot of those minerals are,Muscle cramps? Don’t make this mistake #animalbased if you have muscle cramps you need to listen to this getting minerals from your food magnesium potassium and calcium is essential for avoiding muscle cramps but a lot of those minerals are
ycDAdAJW1tA,Interrogated on TV about the risks of red meat #animalbased,Dr saladino when you're recommending this diet what risks do you discuss with your patients I don't think there are any risks to eating animal food and you are a psychiatrist am I correct a,Interrogated on TV about the risks of red meat #animalbased Dr saladino when you're recommending this diet what risks do you discuss with your patients I don't think there are any risks to eating animal food and you are a psychiatrist am I correct a
T8Mlb8UwFSg,Eat MORE cheese for heart health #animalbased,here's why you should eat more cheese there are tons of research studies of All Sorts Interventional observational showing associations between increased,Eat MORE cheese for heart health #animalbased here's why you should eat more cheese there are tons of research studies of All Sorts Interventional observational showing associations between increased
VMBUdK_8tq0,The benefits of raw milk for humans,raw milk is amazing for humans there are benefits to gut Flora benefits to kids who grow up drinking this who have less allergy eczema and Asthma there are,The benefits of raw milk for humans raw milk is amazing for humans there are benefits to gut Flora benefits to kids who grow up drinking this who have less allergy eczema and Asthma there are
5sfYdF5hH4A,The history of raw kefir!,the following clip on raw milk was removed from YouTube but it's so important and so helpful that I really want you guys to see this raw milk cafir is an incredibly nutritionally dense whole food that's fantastic for the gut,The history of raw kefir! the following clip on raw milk was removed from YouTube but it's so important and so helpful that I really want you guys to see this raw milk cafir is an incredibly nutritionally dense whole food that's fantastic for the gut
duSztJPud78,Sweetgreen removed seed oils from their menu!,sweet green just announced they are removing oils from their cooking oil and phasing it out from their salad dressings this is amazing guys last year I did a video calling them out sweet,Sweetgreen removed seed oils from their menu! sweet green just announced they are removing oils from their cooking oil and phasing it out from their salad dressings this is amazing guys last year I did a video calling them out sweet
RZDoHVL5Hqs,What’s in Starbucks pumpkin spice latte?,your pumpkin spice latte contains 27 ingredients the second ingredient is processed sugar 50 g of processed sugar,What’s in Starbucks pumpkin spice latte? your pumpkin spice latte contains 27 ingredients the second ingredient is processed sugar 50 g of processed sugar
2HHDc8kL6SQ,Vitamin C has a dirty little secret #health #animalbased #nutrition,your vitamin C supplement has a dirty little secret look at this guys vitamin C supplements are ascorbic acid synthetic ascorbic acid is made from GMO corn and the vast majority of GMO corn,Vitamin C has a dirty little secret #health #animalbased #nutrition your vitamin C supplement has a dirty little secret look at this guys vitamin C supplements are ascorbic acid synthetic ascorbic acid is made from GMO corn and the vast majority of GMO corn
ZumgNd3i4Z8,3 foods to combat hair loss,these Foods combat hair loss meat eggs liver these foods contain unique nutrients that have been proven repeatedly to slow prevent and in some cases even reverse male and female,3 foods to combat hair loss these Foods combat hair loss meat eggs liver these foods contain unique nutrients that have been proven repeatedly to slow prevent and in some cases even reverse male and female
Rwkkw_feqvk,This is the best food for sexual health 🍆,this is the best food for sexual health and libido not this this meat like this ribey or ground beef the idea here is,This is the best food for sexual health 🍆 this is the best food for sexual health and libido not this this meat like this ribey or ground beef the idea here is
ZgRoz60ugnc,DEXA scan reveals “side effects” of red meat #animalbased,I'm going to go get a dexa scan after eating an animal- based diet for 5 and 1/2 years okay so visceral fat3 lb it's on the lower end of what I tend to see in dexa scans so what do you think of the bone density clearly above negative,DEXA scan reveals “side effects” of red meat #animalbased I'm going to go get a dexa scan after eating an animal- based diet for 5 and 1/2 years okay so visceral fat3 lb it's on the lower end of what I tend to see in dexa scans so what do you think of the bone density clearly above negative
6sU8HX0awro,This is my supplement stack…,this is my supplement stack I just took a multivitamin creatine collagen and electrolytes and this is what it looks like I can get all of those things in highly bioavailable forms in food check,This is my supplement stack… this is my supplement stack I just took a multivitamin creatine collagen and electrolytes and this is what it looks like I can get all of those things in highly bioavailable forms in food check
