Video ID,Title,Transcript,Combined_Text
zqdxQWTdIM4,The Absolute Best Natural Vitamin for Arthritis - And It's Not Vitamin D #drberg #arthritis #health,I'm going to show you the absolute best natural vitamin for arthritis and it's not vitamin D I took this for a different purpose and then I woke up and I'm like why is my neck so loose,The Absolute Best Natural Vitamin for Arthritis - And It's Not Vitamin D #drberg #arthritis #health I'm going to show you the absolute best natural vitamin for arthritis and it's not vitamin D I took this for a different purpose and then I woke up and I'm like why is my neck so loose
aYV9EWaiz_Y,3 Tips to Lose Weight While Sleeping #health #weightloss #keto #drberg,I'm going to give you three tips to help you lose more weight while you're sleeping and by the way if you don't burn fat when you're awake at all and the last tip is going to be the most important tip number three let's go,3 Tips to Lose Weight While Sleeping #health #weightloss #keto #drberg I'm going to give you three tips to help you lose more weight while you're sleeping and by the way if you don't burn fat when you're awake at all and the last tip is going to be the most important tip number three let's go
G4guVvCYAEA,Discover the biggest culprit behind inflammation: ultra-processed foods! #DrBerg #HealthyLifestyle,the absolute number one most inflammatory food in the world is ultr processed foods now this is a group or a category of foods composed of primarily,Discover the biggest culprit behind inflammation: ultra-processed foods! #DrBerg #HealthyLifestyle the absolute number one most inflammatory food in the world is ultr processed foods now this is a group or a category of foods composed of primarily
u0-U3-f4VHM,Explore the health advantages provided by ginger in this video! 🌿✨#DrBerg HealthyLifestyle #Ginger,you know if you went to your kitchen right now and looked in your spice rack in your cupboard you probably would have this right here this is called ginger right well did you realize that Ginger,Explore the health advantages provided by ginger in this video! 🌿✨#DrBerg HealthyLifestyle #Ginger you know if you went to your kitchen right now and looked in your spice rack in your cupboard you probably would have this right here this is called ginger right well did you realize that Ginger
llDg68l626M,"Craving some KFC? 🍗🍟 Before your next run, discover what's really in that juicy chicken! #kfc",all right we're at our favorite restaurant KFC and let's see we got we have uh these things right here let's see if it bounces yeah it does all right,"Craving some KFC? 🍗🍟 Before your next run, discover what's really in that juicy chicken! #kfc all right we're at our favorite restaurant KFC and let's see we got we have uh these things right here let's see if it bounces yeah it does all right"
OahN4mwd6C4,Tudca to the rescue! Let's find out the amazing benefits of this compound  #ketodietdrberg  #tudca,now think about what breathing problems involve right the diaphragm so you here you have this gallbladder /b duct issue congestion whatever you want to call it,Tudca to the rescue! Let's find out the amazing benefits of this compound  #ketodietdrberg  #tudca now think about what breathing problems involve right the diaphragm so you here you have this gallbladder /b duct issue congestion whatever you want to call it
VghsZO9QO_M,"From blood pressure to cholesterol control, Garlic a versatile remedy with antiviral properties",so right now in your kitchen in your cupboard you probably have this right garlic powder this is like a natural remedy for so many different things okay,"From blood pressure to cholesterol control, Garlic a versatile remedy with antiviral properties so right now in your kitchen in your cupboard you probably have this right garlic powder this is like a natural remedy for so many different things okay"
9tHeg6Iq1kk,A carb that is more dangerous than sugar. It can spike blood sugars significantly. What is it?,there's this carb that is way more dangerous than sugar okay now people tend to think sugar is the worst thing but there's other things that are even worse than sugar and this specific carb,A carb that is more dangerous than sugar. It can spike blood sugars significantly. What is it? there's this carb that is way more dangerous than sugar okay now people tend to think sugar is the worst thing but there's other things that are even worse than sugar and this specific carb
AD2sPmVxcwU,Uncover the significance of zinc! It involves in 300+ enzymes and many other important functions,zinc is involved in so many different things it's involved in 300 different enzymes and over a thousand different factors related to your DNA its,Uncover the significance of zinc! It involves in 300+ enzymes and many other important functions zinc is involved in so many different things it's involved in 300 different enzymes and over a thousand different factors related to your DNA its
IjQJkjrXCC4,Learn effective stress management to safeguard against physical issues like elevated BP and anxiety,I think you already know that stress can also cause disease too right it can cause ulcers heart attacks it can cause osteoporosis it can cause high blood pressure it can cause anxiety depression,Learn effective stress management to safeguard against physical issues like elevated BP and anxiety I think you already know that stress can also cause disease too right it can cause ulcers heart attacks it can cause osteoporosis it can cause high blood pressure it can cause anxiety depression
L59jXhtPvNM,Decoding Burger King's $6.50 Impossible Burger! 🍔  #BurgerKing #DrBerg,all right today we're going to talk about Burger King and the impossible burger that you can get for $6.50 so the first ingredient is this,Decoding Burger King's $6.50 Impossible Burger! 🍔  #BurgerKing #DrBerg all right today we're going to talk about Burger King and the impossible burger that you can get for $6.50 so the first ingredient is this
A2x33zFsTLA,My terrible painful heartburn was the best thing that ever happened to me #drberg #heartburn,my terrible painful heartburn was the best thing that ever happened to me there are three things to do but one of these things that I'm going to share with you will actually correct it let's,My terrible painful heartburn was the best thing that ever happened to me #drberg #heartburn my terrible painful heartburn was the best thing that ever happened to me there are three things to do but one of these things that I'm going to share with you will actually correct it let's
afWHeLiejPY,Top 3 Intermittent Fasting Tips To Lose Belly Fat🔥 #bellyfat #fatloss #weightloss,to lose your belly fat there are three tips that you need to know relating to doing intermittent fasting and one of these tips is way more important than the others tip number one make sure you,Top 3 Intermittent Fasting Tips To Lose Belly Fat🔥 #bellyfat #fatloss #weightloss to lose your belly fat there are three tips that you need to know relating to doing intermittent fasting and one of these tips is way more important than the others tip number one make sure you
ntQ5IbULu7U,Experiencing one-sided inflammation? It might be linked to your gallbladder #HealthyLifestyle,if you have any inflammation on the right side of your body okay I don't care if it's fibromyalgia or shoulder pain or a headache on the right side or anything down in the lower part of your,Experiencing one-sided inflammation? It might be linked to your gallbladder #HealthyLifestyle if you have any inflammation on the right side of your body okay I don't care if it's fibromyalgia or shoulder pain or a headache on the right side or anything down in the lower part of your
W_8nrFXzw_4,"Notice chronic cough, fatigue, or cramps? They could indicate calcium or magnesium deficiency",if you are deficient in calcium you may find that you have this chronic cough okay and you may find that um you're tired but you just can't go to sleep,"Notice chronic cough, fatigue, or cramps? They could indicate calcium or magnesium deficiency if you are deficient in calcium you may find that you have this chronic cough okay and you may find that um you're tired but you just can't go to sleep"
pY1fV-P1YnI,Maximize vitamin D benefits with vitamin K2! ☀️ Pairing them is key to regulating calcium absorption,you know I talk a lot about vitamin D but I wouldn't recommend taking vitamin D by itself I would always take vitamin K2 with vitamin D because vitamin D3 increases calcium absorption in your,Maximize vitamin D benefits with vitamin K2! ☀️ Pairing them is key to regulating calcium absorption you know I talk a lot about vitamin D but I wouldn't recommend taking vitamin D by itself I would always take vitamin K2 with vitamin D because vitamin D3 increases calcium absorption in your
6nnp1YJF1OA,"Hardee's meal: fries in inflammatory oils, honey mustard, and MSG-laden chicken tenders #hardees",all right so today we're at one of my favorite restaurants paries okay so today we have some fries which is a great combination between soy or corn,"Hardee's meal: fries in inflammatory oils, honey mustard, and MSG-laden chicken tenders #hardees all right so today we're at one of my favorite restaurants paries okay so today we have some fries which is a great combination between soy or corn"
DavA5kfaqaU,Unlock the power of cinnamon in your spice rack! 🌿  #NaturalRemedies #DrBerg,you know so many people have blood sugar problems they're worried about their diabetes pre-diabetes Etc well in your cupboard right now you probably have an amazing remedy it's in the spice rack,Unlock the power of cinnamon in your spice rack! 🌿  #NaturalRemedies #DrBerg you know so many people have blood sugar problems they're worried about their diabetes pre-diabetes Etc well in your cupboard right now you probably have an amazing remedy it's in the spice rack
nqpMzWGPxHo,"Less than 5 hours of sleep harms health, affecting workout recovery, and  promoting weight gain",if you can't sleep right you're getting less than 5 hours and you have this sympathetic overdrive and you're trying to lose weight good luck it's not going to happen in fact you can work with,"Less than 5 hours of sleep harms health, affecting workout recovery, and  promoting weight gain if you can't sleep right you're getting less than 5 hours and you have this sympathetic overdrive and you're trying to lose weight good luck it's not going to happen in fact you can work with"
o_SS8cGGFbI,"If your rib and spine feel restricted, it can negatively impact your breathing. #DrBerg",so you have the spine you have all these different ribs that connect to the spine but this articulation between the rib and the spine and your back if it's,"If your rib and spine feel restricted, it can negatively impact your breathing. #DrBerg so you have the spine you have all these different ribs that connect to the spine but this articulation between the rib and the spine and your back if it's"
yUNWFEiJb6I,"At McDonald's today, delving into the addictive snacks! 🍟 Let's talk about what's inside #McDonalds",all right rabbit D today and we want to talk about these right here um man are these addictive so you have a combination of different oils they're all seed oils corn canola soy soy,"At McDonald's today, delving into the addictive snacks! 🍟 Let's talk about what's inside #McDonalds all right rabbit D today and we want to talk about these right here um man are these addictive so you have a combination of different oils they're all seed oils corn canola soy soy"
z4Lx1x6mNVc,Let's talk about the vital balance between CO2 and oxygen – the balance that keeps us thriving,what does acid reflex or silent reflex have to do with your breathing well apparently there's a lot of um sensory nerves in your esophagus that go right to your brain and that will give your,Let's talk about the vital balance between CO2 and oxygen – the balance that keeps us thriving what does acid reflex or silent reflex have to do with your breathing well apparently there's a lot of um sensory nerves in your esophagus that go right to your brain and that will give your
D318YEnHPeg,"Introducing AHCC: Shiitake extract fights warts, backed by 100+ trials #SkinHealth #DrBerg",so I recently did a video on how to get rid of a wart or a skin tag using this amazing amazing remedy that I just,"Introducing AHCC: Shiitake extract fights warts, backed by 100+ trials #SkinHealth #DrBerg so I recently did a video on how to get rid of a wart or a skin tag using this amazing amazing remedy that I just"
lCHoCeUdoII,Discover the fascinating link between oxygen and carbon dioxide in this captivating video! #DrBerg,what does acid reflex or silent reflex have to do with your breathing well apparently there's a lot of um sensory nerves in your esophagus that go right to your brain and that will give your,Discover the fascinating link between oxygen and carbon dioxide in this captivating video! #DrBerg what does acid reflex or silent reflex have to do with your breathing well apparently there's a lot of um sensory nerves in your esophagus that go right to your brain and that will give your
FJj5mY2KS2M,"If there is a ""health food"" section, what does that tell us about the food in the rest of the store?",so I have a question for you when you're at the grocery store and you are at the tiny little corner of the store called the health food section what does that,"If there is a ""health food"" section, what does that tell us about the food in the rest of the store? so I have a question for you when you're at the grocery store and you are at the tiny little corner of the store called the health food section what does that"
vSMmAjFCP4w,Watch this video to see the negative effects of vitamin D and magnesium deficiency #VitaminD,I'd like to talk about vitamin D and magnesium okay did you realize that the receptors for absorbing vitamin D are completely and utterly dependent on magnesium if you have no magnesium you,Watch this video to see the negative effects of vitamin D and magnesium deficiency #VitaminD I'd like to talk about vitamin D and magnesium okay did you realize that the receptors for absorbing vitamin D are completely and utterly dependent on magnesium if you have no magnesium you
f54Fr1Nidaw,Sip on the World's Healthiest Lemonade! 🍋✨  #HealthyLifestyle #DrBerg,want to show you how to make the healthiest lemonade in the world now why is it so healthy because it has zero sugars most lemonade has like 7 and 1/2,Sip on the World's Healthiest Lemonade! 🍋✨  #HealthyLifestyle #DrBerg want to show you how to make the healthiest lemonade in the world now why is it so healthy because it has zero sugars most lemonade has like 7 and 1/2
U1dEuvAFTNU,Unlock the secret to a balanced and healthy life with the power of sodium!   #DrBerg,When you sweat uh it's really salty and then also if you're drinking a lot of plain water without salt you're just going to create a situation where you're going to actually be very deficient in salt just as a side note one of the,Unlock the secret to a balanced and healthy life with the power of sodium!   #DrBerg When you sweat uh it's really salty and then also if you're drinking a lot of plain water without salt you're just going to create a situation where you're going to actually be very deficient in salt just as a side note one of the
seoNCxlrmM0,Avoid these common pitfalls in your intermittent fasting journey! 🚫 #IntermittentFasting #DrBerg,I want to discuss the top mistakes that people make when they start intermittent fasting number one eating way too much what you have to realize is that when you're not eating you are eating you're eating your own fat so it's not that,Avoid these common pitfalls in your intermittent fasting journey! 🚫 #IntermittentFasting #DrBerg I want to discuss the top mistakes that people make when they start intermittent fasting number one eating way too much what you have to realize is that when you're not eating you are eating you're eating your own fat so it's not that
Nrl_X5wE0uw,Restful nights start with stress management. Discover how to improve your sleep! #HealthyLifestyle,I want to discuss the top mistakes that people make when they start intermittent fasting number one eating way too much what you have to realize is that when you're not eating you are eating you're eating your own fat so it's not that,Restful nights start with stress management. Discover how to improve your sleep! #HealthyLifestyle I want to discuss the top mistakes that people make when they start intermittent fasting number one eating way too much what you have to realize is that when you're not eating you are eating you're eating your own fat so it's not that
vDa8341QhNw,Discover the harsh reality of weight loss drugs and their detrimental effects on your body💊 #DrBerg,so I wanted to respond to an article um on how OIC in wovi could break the Health Care system because now if you have these weight loss drugs that are actually helping people lose weight and,Discover the harsh reality of weight loss drugs and their detrimental effects on your body💊 #DrBerg so I wanted to respond to an article um on how OIC in wovi could break the Health Care system because now if you have these weight loss drugs that are actually helping people lose weight and
Hz6EBeJP3vI,Did you know that drinking too much water can actually lead to your brain becoming waterlogged?,there's even a condition called e a that's a condition where the person is water logged okay and it's creating a lot of swelling in the brain and that could easily come from just drinking too much water and this often occurs when,Did you know that drinking too much water can actually lead to your brain becoming waterlogged? there's even a condition called e a that's a condition where the person is water logged okay and it's creating a lot of swelling in the brain and that could easily come from just drinking too much water and this often occurs when
RW7STOpaRvg,"Yesterday, I asked you to guess the worst ingredient in processed foods - let's find out what it is!",you know the other day I was shopping at the grocery store and I bought this right here keto friendly Duncan hindes chewy fudge brownie mix right is it too,"Yesterday, I asked you to guess the worst ingredient in processed foods - let's find out what it is! you know the other day I was shopping at the grocery store and I bought this right here keto friendly Duncan hindes chewy fudge brownie mix right is it too"
6jSpyG0rRT0,Question time! Can you guess which sneaky ingredient in most junk foods wreaks havoc on your health?,so I have a question for you if you can answer this out of all the ingredients to ultrapress Foods or junk foods which ingredient out of all of those is the absolute worst and has the biggest,Question time! Can you guess which sneaky ingredient in most junk foods wreaks havoc on your health? so I have a question for you if you can answer this out of all the ingredients to ultrapress Foods or junk foods which ingredient out of all of those is the absolute worst and has the biggest
QifjPgYfIiE,"Stay active, and live longer! Exercise is the key to a healthy life 💪 #DrBerg #HealthyLifestyle",takes is just a little bit of exercise to produce significant health benefits and I'm talking about lowering your risk for certain diseases and increasing your longevity living longer it doesn't take,"Stay active, and live longer! Exercise is the key to a healthy life 💪 #DrBerg #HealthyLifestyle takes is just a little bit of exercise to produce significant health benefits and I'm talking about lowering your risk for certain diseases and increasing your longevity living longer it doesn't take"
aT0rBaHMRns,Did you know that a whopping 71% to 83% of grocery store calories come from ultra-processed foods?,did you realize that 71 to 83% of all the calories sold in the grocery store are what's considered ultr processed,Did you know that a whopping 71% to 83% of grocery store calories come from ultra-processed foods? did you realize that 71 to 83% of all the calories sold in the grocery store are what's considered ultr processed
iwsdIX0_qK4,Discover the shocking effects of sugar on our health. Brace yourself! #DrBerg #HealthyLifestyle,now you may just end up quitting sugar after watching this video I'm just warning you don't get mad at me I'm just the messenger there are 703 meta analysis that make up 8600 different,Discover the shocking effects of sugar on our health. Brace yourself! #DrBerg #HealthyLifestyle now you may just end up quitting sugar after watching this video I'm just warning you don't get mad at me I'm just the messenger there are 703 meta analysis that make up 8600 different
oEvhzW_lbTM,Join me on a journey to uncover the truth about coffee's influence on weight loss #coffee #drberg,"so there was a quite large study there was I think over 80,000 people involved in this study called the nurse's health study and they looked over four years of who gained weight and who didn't gain weight and they looked at variables and","Join me on a journey to uncover the truth about coffee's influence on weight loss #coffee #drberg so there was a quite large study there was I think over 80,000 people involved in this study called the nurse's health study and they looked over four years of who gained weight and who didn't gain weight and they looked at variables and"
fbIz1ozqRYQ,Have you seen this unique exercise yet?! Would you try this at home? #reaction #drberg #health,[Music],Have you seen this unique exercise yet?! Would you try this at home? #reaction #drberg #health [Music]
Y8XQNFyMe8M,"In this video, I unveil the BEST anti-inflammatory food that'll have you feeling unstoppable",what is the number one best anti-inflammatory food in the entire world can you take a guess you think it's omega-3 Fetti acids fish oils not even close there are so many things that,"In this video, I unveil the BEST anti-inflammatory food that'll have you feeling unstoppable what is the number one best anti-inflammatory food in the entire world can you take a guess you think it's omega-3 Fetti acids fish oils not even close there are so many things that"
KD2zUbWrkAM,🥦 Stay focused on your weight loss goals by avoiding unnecessary snacking! 💪 #keto #DrBerg,all right another Factor that's very important is the frequency of eating okay if you're snacking if you're eating between meals if you're even eating three meals a day that can slow things,🥦 Stay focused on your weight loss goals by avoiding unnecessary snacking! 💪 #keto #DrBerg all right another Factor that's very important is the frequency of eating okay if you're snacking if you're eating between meals if you're even eating three meals a day that can slow things
wi6SHudf2PY,"Biotin is key for healthy hair, skin, and nails. Boost your biotin intake with my biotin shampoo!",there's other things that cause a deficiency of biotin that you need to know if you consume raw egg whes because it locks up biotin if you're on the ketogenic diet your demand for biotin,"Biotin is key for healthy hair, skin, and nails. Boost your biotin intake with my biotin shampoo! there's other things that cause a deficiency of biotin that you need to know if you consume raw egg whes because it locks up biotin if you're on the ketogenic diet your demand for biotin"
32K_bo7E66M,Tune in to this video for a revealing insight into foods that trigger inflammation. 💥 #inflammation,foods that create the most inflammation would be related to something like gluten which actually is in grains most of the grains create inflammation in your gut most people with arthritis,Tune in to this video for a revealing insight into foods that trigger inflammation. 💥 #inflammation foods that create the most inflammation would be related to something like gluten which actually is in grains most of the grains create inflammation in your gut most people with arthritis
Kfn7YpAlmPs,"🍎 Who knew that the ""mother"" in your apple cider vinegar jar held such secrets?",now I hate to break this to you but that mother and the oppsite of vinegar and the bottom of the bottle is not what you think what you've been told it's a,"🍎 Who knew that the ""mother"" in your apple cider vinegar jar held such secrets? now I hate to break this to you but that mother and the oppsite of vinegar and the bottom of the bottle is not what you think what you've been told it's a"
Ba6QLhycpy8,Have you seen this unique exercise yet?! Would you try this at home? #drberg,[Music],Have you seen this unique exercise yet?! Would you try this at home? #drberg [Music]
_achdhdxIH0,"Let's build a fitness reserve, one workout at a time! 💪🏋️‍♀️  #health #keto #fitness #drberg",developing more Fitness also improves your insulin sensitivity so if you had insulin resistance at one time developing more of a fitness Reserve can greatly help your blood sugars and allow,"Let's build a fitness reserve, one workout at a time! 💪🏋️‍♀️  #health #keto #fitness #drberg developing more Fitness also improves your insulin sensitivity so if you had insulin resistance at one time developing more of a fitness Reserve can greatly help your blood sugars and allow"
gO0mUN3MAoM,Drink this once a day and watch your inflammation disappear! #DrBerg #HealthyLifestyle #Inflammation,if you wanted an amazing drink to drop inflammation in your body especially inflammation in your gut here's the best drink and this is based on a YouTube video that I did recently but I will say,Drink this once a day and watch your inflammation disappear! #DrBerg #HealthyLifestyle #Inflammation if you wanted an amazing drink to drop inflammation in your body especially inflammation in your gut here's the best drink and this is based on a YouTube video that I did recently but I will say
